track_name,track_url,album_name,album_url,artist_name,artist_url,date_added,duration_ms,date_first_scraped,description,playlist_name
Ghar Aaya Mera Pardesi - Ft. Ayesha Mulla,https://open.spotify.com/track/29sLYvB8oIfMNYpfBnRMir,Ghar Aaya Mera Pardesi - Ft. Ayesha Mulla,https://open.spotify.com/album/6S8HSxbR6bGa9sb7TSOXXi,"Fazilpuria, Jyotica Tangri","https://open.spotify.com/artist/4oaJL0V5asQDh4sqplTVhX, https://open.spotify.com/artist/5wQDQFm7Ku8WWGi5xqJ9lp",2022-05-24,215142,2022-05-30,"Hits, repackaged by Bollywood. Cover - Badrinath Ki Dulhania",Bollywood 2.O
"Goli Maar Bheje Mein - From ""Crazxy""",https://open.spotify.com/track/3TjOqwchaqnCOrAa8AGIa7,"Goli Maar Bheje Mein (From ""Crazxy"")",https://open.spotify.com/album/0x6g2DyjtXmoUTQLr2PbdR,"Ila Arun, Paroma Dasgupta, Siddharth Basrur, Vishal Bhardwaj, Gulzar, Vayu, The Red Kettle","https://open.spotify.com/artist/5zWKMBKw7KqulFxyz2ULvp, https://open.spotify.com/artist/1pvVz9G8uL8K0ZVEnqm1SQ, https://open.spotify.com/artist/6PtoffEX0RiktNdmCeuWkl, https://open.spotify.com/artist/1JdHoZwkwOmX2Pl2iTwnzc, https://open.spotify.com/artist/0yRC5n90spXG0d3aiDQ0vB, https://open.spotify.com/artist/5vwmYR4hN6lASQJUMWPrEL, https://open.spotify.com/artist/3c80ccDH0a6xrV8Y3UAYKX",2025-02-24,218717,2022-05-30,"Hits, repackaged by Bollywood. Cover - Badrinath Ki Dulhania",Bollywood 2.O
"Gore Gore Mukhde Pe (From ""Ishq Vishk Rebound"")",https://open.spotify.com/track/6oEzMhDX6l57GqxUZ5D5Wq,"Gore Gore Mukhde Pe (From ""Ishq Vishk Rebound"")",https://open.spotify.com/album/0Kevydmla0xVFBwcSyL9bd,"Udit Narayan, Badshah, Nikhita Gandhi, Anand-Milind, Sameer Anjaan, Hiten","https://open.spotify.com/artist/70B80Lwx2sxti0M1Ng9e8K, https://open.spotify.com/artist/0y59o4v8uw5crbN9M3JiL1, https://open.spotify.com/artist/3tPQOjkxO3mrYrrgkTeXgH, https://open.spotify.com/artist/2owjgBZQ70LoCNHIgW3gSk, https://open.spotify.com/artist/5sifufajls8Q6k04Y4F8mH, https://open.spotify.com/artist/597A6e3D22Vq4gxyh4mUjh",2024-06-14,146470,2022-05-30,"Hits, repackaged by Bollywood. Cover - Badrinath Ki Dulhania",Bollywood 2.O
"Gori Hai Kalaiyan - From ""Mere Husband Ki Biwi""",https://open.spotify.com/track/2vCm8wo8NPlCRrqSGo8PTt,"Gori Hai Kalaiyan (From ""Mere Husband Ki Biwi"")",https://open.spotify.com/album/2WdgB8uCQepXV0pVT7t1hZ,"Badshah, Akshay & IP, Kanika Kapoor, Sharvi Yadav, IP Singh","https://open.spotify.com/artist/0y59o4v8uw5crbN9M3JiL1, https://open.spotify.com/artist/2jiSIlVrIaBnJA2x4jqqvf, https://open.spotify.com/artist/6qcIg4IPLulyc03mWR87N8, https://open.spotify.com/artist/30DC0uyycct5LGcqhzE6a3, https://open.spotify.com/artist/7pauOFC9bRqioSX30AvNkG",2025-02-06,136224,2022-05-30,"Hits, repackaged by Bollywood. Cover - Badrinath Ki Dulhania",Bollywood 2.O
Gulabi 2.0,https://open.spotify.com/track/1yGCVeGnN9HoZfPNfuD4Vq,"Gulabi 2.0 (From ""Noor"")",https://open.spotify.com/album/54MbLJS93ixcpdkRvMFZQe,"Amaal Mallik, Tulsi Kumar, Yash Narvekar, R. D. Burman","https://open.spotify.com/artist/76fuWYgIf3TVIopTs3vaJ6, https://open.spotify.com/artist/0T1CMVkqffHlqEk4BcAph1, https://open.spotify.com/artist/4RlnRVxKm3jnUzOP4czbIK, https://open.spotify.com/artist/2JSYASbWU5Y0fVpts3Eq7g",2022-05-24,212237,2022-05-30,"Hits, repackaged by Bollywood. Cover - Badrinath Ki Dulhania",Bollywood 2.O
"Haan Main Galat (From ""Love Aaj Kal"")",https://open.spotify.com/track/068HSvCf5MbQfhV4qqaelg,"Haan Main Galat (From ""Love Aaj Kal"")",https://open.spotify.com/album/5e0lk4qOylKNYoQKe7nxhC,"Pritam, Arijit Singh, Shashwat Singh","https://open.spotify.com/artist/1wRPtKGflJrBx9BmLsSwlU, https://open.spotify.com/artist/4YRxDV8wJFPHPTeXepOstw, https://open.spotify.com/artist/6iv4lysB1yHXoZJ2gfqTdh",2022-05-24,218644,2022-05-30,"Hits, repackaged by Bollywood. Cover - Badrinath Ki Dulhania",Bollywood 2.O
Halka Halka,https://open.spotify.com/track/3DbNXniRprbs23Vlmy4roM,Fanney Khan,https://open.spotify.com/album/1z7NW9uaQiS8aFlRjoYjPT,"Sunidhi Chauhan, Divya Kumar, Amit Trivedi","https://open.spotify.com/artist/3eDT9fwXKuHWFvgZaaYC5v, https://open.spotify.com/artist/0NErdIJtuKBjtxKmlqaWdj, https://open.spotify.com/artist/7HCqGPJcQTyGJ2yqntbuyr",2023-05-25,247381,2022-05-30,"Hits, repackaged by Bollywood. Cover - Badrinath Ki Dulhania",Bollywood 2.O
Har Kisi Ko,https://open.spotify.com/track/7FPbxfwWa2gzB9ePX19I5z,Boss,https://open.spotify.com/album/0mHODvSNdVtPZOP5pcNWep,"Arijit Singh, Neeti Mohan","https://open.spotify.com/artist/4YRxDV8wJFPHPTeXepOstw, https://open.spotify.com/artist/3ZxZ03fj3tXBZHZWzvaLSM",2023-05-25,337046,2022-05-30,"Hits, repackaged by Bollywood. Cover - Badrinath Ki Dulhania",Bollywood 2.O
Hare Krishna Hare Ram,https://open.spotify.com/track/3jxLgfqFTA2jYENuPfnRMi,Commando 2,https://open.spotify.com/album/2MjvC3aZFRXfFhJ3dPK2U2,"Armaan Malik, Ritika, Raftaar","https://open.spotify.com/artist/4IKVDbCSBTxBeAsMKjAuTs, https://open.spotify.com/artist/2Qb7kA0AAtP7swrz2l3Jpq, https://open.spotify.com/artist/5UdFr0GeO7jKIaNIJgwB36",2023-05-25,210187,2022-05-30,"Hits, repackaged by Bollywood. Cover - Badrinath Ki Dulhania",Bollywood 2.O
Haseeno Ka Deewana,https://open.spotify.com/track/6VNBEaG5sidkK3lwq7Ws0I,Kaabil,https://open.spotify.com/album/1YQ3etszbfhZZNDqWmKdLa,"Raftaar, Payal Dev","https://open.spotify.com/artist/5UdFr0GeO7jKIaNIJgwB36, https://open.spotify.com/artist/6FtZhorjCMfkaVJ7kKdmq7",2022-05-24,229208,2022-05-30,"Hits, repackaged by Bollywood. Cover - Badrinath Ki Dulhania",Bollywood 2.O
"Hasina Pagal Deewani (From ""Indoo Ki Jawani"")",https://open.spotify.com/track/5DXdMe87gdsoN4MSqWRcnt,"Hasina Pagal Deewani (From ""Indoo Ki Jawani"")",https://open.spotify.com/album/2SsdnisdqpAXBvdkiMc5wp,"Mika Singh, Asees Kaur","https://open.spotify.com/artist/5T2I75UlGBcWd5nVyfmL13, https://open.spotify.com/artist/1sVmXkzX2ukc6QvasrDBES",2022-05-24,188824,2022-05-30,"Hits, repackaged by Bollywood. Cover - Badrinath Ki Dulhania",Bollywood 2.O
"Hauli Hauli (From ""Khel Khel Mein"")",https://open.spotify.com/track/1riuemY0uGVSZ1YzVTmmUw,"Hauli Hauli (From ""Khel Khel Mein"")",https://open.spotify.com/album/4RnA4EP9q4Q6NRcjARwUCU,"Guru Randhawa, Yo Yo Honey Singh, Neha Kakkar","https://open.spotify.com/artist/5rQoBDKFnd1n6BkdbgVaRL, https://open.spotify.com/artist/7uIbLdzzSEqnX0Pkrb56cR, https://open.spotify.com/artist/5f4QpKfy7ptCHwTqspnSJI",2024-07-30,168016,2022-05-30,"Hits, repackaged by Bollywood. Cover - Badrinath Ki Dulhania",Bollywood 2.O
"Hawa Hawai 2.0 (From ""Tumhari Sulu"")",https://open.spotify.com/track/68pyYudVJIEOvr93rCYWSJ,"Hawa Hawai 2.0 (From ""Tumhari Sulu"")",https://open.spotify.com/album/2LTKoPnGYJCjbhwgsHfFLt,"Kavita Krishnamurthy, Shashaa Tirupati, Tanishk Bagchi, Laxmikant–Pyarelal","https://open.spotify.com/artist/6WPmTGeeoymoVlXVtsCwz7, https://open.spotify.com/artist/12CpR4SNDzVIlDoPSeNFeW, https://open.spotify.com/artist/4f7KfxeHq9BiylGmyXepGt, https://open.spotify.com/artist/3yS84AjNFqhmuJlIXy7sax",2022-05-24,178352,2022-05-30,"Hits, repackaged by Bollywood. Cover - Badrinath Ki Dulhania",Bollywood 2.O
"Hindustani (From ""Street Dancer 3D"")",https://open.spotify.com/track/5NOA6Cl1w8cMvKvp9hg9hI,"Hindustani (From ""Street Dancer 3D"")",https://open.spotify.com/album/4u8ws3FM6VPeXebC1KBFMt,"Shankar Mahadevan, Udit Narayan, Harsh Upadhyay, Shankar-Ehsaan-Loy","https://open.spotify.com/artist/1SJOL9HJ08YOn92lFcYf8a, https://open.spotify.com/artist/70B80Lwx2sxti0M1Ng9e8K, https://open.spotify.com/artist/3y0Y3G1hDwoQv48m7U6NdU, https://open.spotify.com/artist/0L5GV6LN8SWWUWIdBbTLTZ",2022-05-24,146063,2022-05-30,"Hits, repackaged by Bollywood. Cover - Badrinath Ki Dulhania",Bollywood 2.O
"Holiyaan - From ""Vedaa""",https://open.spotify.com/track/4s2O13zv052LCfm2a5FNKv,"Holiyaan (From ""Vedaa"")",https://open.spotify.com/album/2LYR7qTEwbSCRyetw9n3a5,"YÜVA, MC SQUARE, Nikhita Gandhi, Asha Sapera, Arushi Kaushal","https://open.spotify.com/artist/4LZiKmRe8lGIn2PfLrgpYK, https://open.spotify.com/artist/5WZViOJ21095FUcGPMpKFF, https://open.spotify.com/artist/3tPQOjkxO3mrYrrgkTeXgH, https://open.spotify.com/artist/4xI3qqjpywDy85g32DVPIC, https://open.spotify.com/artist/3GYFWgZYy0KWnyqaBWdBpW",2024-08-03,185806,2022-05-30,"Hits, repackaged by Bollywood. Cover - Badrinath Ki Dulhania",Bollywood 2.O
Honthon Pe Bas,https://open.spotify.com/track/361LZXDUFnOk0XRam2AQ5M,Honthon Pe Bas,https://open.spotify.com/album/4x4ZKleHwVinylgN3qJ0Np,Mika Singh,https://open.spotify.com/artist/5T2I75UlGBcWd5nVyfmL13,2022-05-24,186274,2022-05-30,"Hits, repackaged by Bollywood. Cover - Badrinath Ki Dulhania",Bollywood 2.O
"Husnn Hai Suhaana New (from ""Coolie No. 1"")",https://open.spotify.com/track/6XvQPMLZdPPV22rY7FEBpI,"Husnn Hai Suhaana New (from ""Coolie No. 1"")",https://open.spotify.com/album/3FkE669VDUI9nh7g86QyAs,"Chandana Dixit, Abhijeet, Tanishk Bagchi, Anand-Milind","https://open.spotify.com/artist/49ZlTVpGT3NxLkTRpPcYO2, https://open.spotify.com/artist/2ZRrPOjBIWoKK5rHedLijj, https://open.spotify.com/artist/4f7KfxeHq9BiylGmyXepGt, https://open.spotify.com/artist/2owjgBZQ70LoCNHIgW3gSk",2022-05-24,267416,2022-05-30,"Hits, repackaged by Bollywood. Cover - Badrinath Ki Dulhania",Bollywood 2.O
I Am A Disco Dancer 2.0,https://open.spotify.com/track/3e3jQKyZenfm88UViF4WL5,I Am A Disco Dancer 2.0 - Tiger Shroff,https://open.spotify.com/album/7E8FEfJ3PCkbNH2qpQB2oV,Benny Dayal,https://open.spotify.com/artist/61if35zz1W11GejEkxTLEQ,2022-05-24,186411,2022-05-30,"Hits, repackaged by Bollywood. Cover - Badrinath Ki Dulhania",Bollywood 2.O
I Am A Disco Dancer 2.0,https://open.spotify.com/track/4p1Z7Y9B1ojFx0SSVt2Rx4,I Am A Disco Dancer 2.0 - Single,https://open.spotify.com/album/2XG2nXlMIp66VxA0aJAtBm,Benny Dayal,https://open.spotify.com/artist/61if35zz1W11GejEkxTLEQ,2022-07-04,186411,2022-05-30,"Hits, repackaged by Bollywood. Cover - Badrinath Ki Dulhania",Bollywood 2.O
Illegal Weapon 2.0,https://open.spotify.com/track/7CY0CmCpSglfUKCBOOiRfw,Street Dancer 3D,https://open.spotify.com/album/50FHINh9xisewZgfucGbVL,"Jasmine Sandlas, Garry Sandhu, Tanishk Bagchi, Intense, Priya Saraiya","https://open.spotify.com/artist/0mJDQBWytBhOh5JB1DOQ1c, https://open.spotify.com/artist/7M3xY5iHSzEtoL3FpqOD75, https://open.spotify.com/artist/4f7KfxeHq9BiylGmyXepGt, https://open.spotify.com/artist/0OS0NZnK7TGIAWx8MkWNFN, https://open.spotify.com/artist/6q29t5RuXxlBuqIZsOMQss",2023-05-25,188606,2022-05-30,"Hits, repackaged by Bollywood. Cover - Badrinath Ki Dulhania",Bollywood 2.O
"Ishare Tere (From ""Kuch Khattaa Ho Jaay"")",https://open.spotify.com/track/5MgJSfWzLzXveqM7xcvuMG,"Ishare Tere (From ""Kuch Khattaa Ho Jaay"")",https://open.spotify.com/album/0SEVLQF8Fgacbp6RBxN0hO,"Guru Randhawa, Zahrah S Khan","https://open.spotify.com/artist/5rQoBDKFnd1n6BkdbgVaRL, https://open.spotify.com/artist/7C5xVXoqim1TICnCMZ9A6P",2024-02-03,158215,2022-05-30,"Hits, repackaged by Bollywood. Cover - Badrinath Ki Dulhania",Bollywood 2.O
"Ishq Vishk Pyaar Vyaar (From ""Ishq Vishk Rebound"")",https://open.spotify.com/track/20xfu3vJXEDthQK34L2Eu5,"Ishq Vishk Pyaar Vyaar (From ""Ishq Vishk Rebound"")",https://open.spotify.com/album/0qCGiv1K28SX0LQjxrF2ap,"Sonu Nigam, Nikhita Gandhi, Rochak Kohli, Mellow D, Gurpreet Saini, Anu Malik, Sameer Anjaan","https://open.spotify.com/artist/1dVygo6tRFXC8CSWURQJq2, https://open.spotify.com/artist/3tPQOjkxO3mrYrrgkTeXgH, https://open.spotify.com/artist/3dN9MQpjIyNxyeRfz4EDZe, https://open.spotify.com/artist/7tH8oZj2nLERlp2hE5QNjp, https://open.spotify.com/artist/3nLLr3ShsQC2Hdrwjl14ie, https://open.spotify.com/artist/71hjb5G92mGoKRSAW3Cj00, https://open.spotify.com/artist/5sifufajls8Q6k04Y4F8mH",2024-05-21,201692,2022-05-30,"Hits, repackaged by Bollywood. Cover - Badrinath Ki Dulhania",Bollywood 2.O
"Jaane Jaan - Title Track (From ""Jaane Jaan"")",https://open.spotify.com/track/5rFTcUfO3ZPztJHEmFOdvM,"Jaane Jaan Title Track (From ""Jaane Jaan"")",https://open.spotify.com/album/5xDXicz8xdAi6jvSH4BrxY,"Neha Kakkar, Sachin-Jigar, Laxmikant–Pyarelal, Rajendra Krishan","https://open.spotify.com/artist/5f4QpKfy7ptCHwTqspnSJI, https://open.spotify.com/artist/1mBydYMVBECdDmMfE2sEUO, https://open.spotify.com/artist/3yS84AjNFqhmuJlIXy7sax, https://open.spotify.com/artist/0wfdmeqX8y9eyNIX9lV0Or",2023-09-11,140468,2022-05-30,"Hits, repackaged by Bollywood. Cover - Badrinath Ki Dulhania",Bollywood 2.O
Jab Koi Baat - Recreated,https://open.spotify.com/track/43GfQ1SC17rBWiHkOtdwK8,Jab Koi Baat - Recreated,https://open.spotify.com/album/1nIe4xtu5pwjRLgegOYdMm,"Atif Aslam, Shirley Setia, Dj Chetas","https://open.spotify.com/artist/2oSONSC9zQ4UonDKnLqksx, https://open.spotify.com/artist/26ks59eSno7UlPCdljHQoI, https://open.spotify.com/artist/1jPeDHvfU5Knw8VyOP6TZN",2022-05-24,192228,2022-05-30,"Hits, repackaged by Bollywood. Cover - Badrinath Ki Dulhania",Bollywood 2.O
"JALSA 2.0 - From ""Mission Raniganj: The Great Bharat Rescue""",https://open.spotify.com/track/4OgcGtcurJBgS7H1iW7peT,"JALSA 2.0 (From ""Mission Raniganj: The Great Bharat Rescue"")",https://open.spotify.com/album/0nUDc18ivjvaNEGh7iJKck,"Satinder Sartaaj, Prem & Hardeep","https://open.spotify.com/artist/4rgw8A5vcYinpZLDKHrEdV, https://open.spotify.com/artist/4ZPpGYjIb5caOhHhQANO8P",2023-09-15,196124,2022-05-30,"Hits, repackaged by Bollywood. Cover - Badrinath Ki Dulhania",Bollywood 2.O
Jeetenge Reprise,https://open.spotify.com/track/5gxkkXdYHzI3HuTCne7UNa,Mission Raniganj: The Great Bharat Rescue (Original Motion Picture Soundtrack),https://open.spotify.com/album/6g2O0UGS1tYmjx618HjY5C,"Arko, Stebin Ben","https://open.spotify.com/artist/6jf2eKjiPT6P18RbOSLzf0, https://open.spotify.com/artist/1UAzmnFgjizIDvtHvnCdEq",2023-09-26,232166,2022-05-30,"Hits, repackaged by Bollywood. Cover - Badrinath Ki Dulhania",Bollywood 2.O
Jiye Toh Jiye Kaise 2.0,https://open.spotify.com/track/5wi8UMMGlsKoBxXmbBFsF6,Jiye Toh Jiye Kaise 2.0,https://open.spotify.com/album/2LWYVZjsG2YbHPRP9lWTcR,Stebin Ben,https://open.spotify.com/artist/1UAzmnFgjizIDvtHvnCdEq,2022-05-24,218372,2022-05-30,"Hits, repackaged by Bollywood. Cover - Badrinath Ki Dulhania",Bollywood 2.O
Kahan Shuru Kahan Khatam Title Track,https://open.spotify.com/track/30IKqBTN2JJe9cKHEDzThC,Kahan Shuru Kahan Khatam,https://open.spotify.com/album/09a2swL9jBNHfRkAV8iBzQ,"Dhvani Bhanushali, Vismay Patel, Lata Mangeshkar, Akshay & IP, IP Singh","https://open.spotify.com/artist/1OPqAyxsQc8mcRmoNBAnVk, https://open.spotify.com/artist/43jHbOAD9UtOEO1la8CVHs, https://open.spotify.com/artist/61JrslREXq98hurYL2hYoc, https://open.spotify.com/artist/2jiSIlVrIaBnJA2x4jqqvf, https://open.spotify.com/artist/7pauOFC9bRqioSX30AvNkG",2024-09-13,176250,2022-05-30,"Hits, repackaged by Bollywood. Cover - Badrinath Ki Dulhania",Bollywood 2.O
Kala Chashma,https://open.spotify.com/track/6mdLX10dvBb7rGYbMXpKzz,Baar Baar Dekho (Original Motion Picture Soundtrack),https://open.spotify.com/album/110yeLSV0XY4Wtu7DnenNq,"Prem & Hardeep, Amar Arshi, Badshah, Neha Kakkar, Indeep Bakshi, Amrik Singh","https://open.spotify.com/artist/4ZPpGYjIb5caOhHhQANO8P, https://open.spotify.com/artist/3f7Qfkua3IcRpUFzUaUnrX, https://open.spotify.com/artist/0y59o4v8uw5crbN9M3JiL1, https://open.spotify.com/artist/5f4QpKfy7ptCHwTqspnSJI, https://open.spotify.com/artist/0Te1QGD9jtzrxPa8nie9OQ, https://open.spotify.com/artist/1Sqacm1VMROsVrDOUwxS5G",2023-11-24,187006,2022-05-30,"Hits, repackaged by Bollywood. Cover - Badrinath Ki Dulhania",Bollywood 2.O
Kanda Chubha,https://open.spotify.com/track/4DFepddZcJVeyRUkXu08P6,Dhoom Dhaam (Original Motion Picture Soundtrack),https://open.spotify.com/album/1zxdJPNSuRtHh5dGh1Upzd,"Sonu Kakkar, Shor Police, Siddhant Kaushal, Ricardo Pereira","https://open.spotify.com/artist/1Pn6pKlgzxcH6iIRp08dQr, https://open.spotify.com/artist/58Wsx9FbcjSM8a6kzLf03W, https://open.spotify.com/artist/18Y28RRuXPliKAa253retJ, https://open.spotify.com/artist/05mCASWISF8a8DF3Mp5JBS",2025-02-11,201904,2022-05-30,"Hits, repackaged by Bollywood. Cover - Badrinath Ki Dulhania",Bollywood 2.O
Kisi Se Pyar Ho Jaye,https://open.spotify.com/track/2RIFyeYTPMHesJsWPW2Z8v,Kaabil,https://open.spotify.com/album/1YQ3etszbfhZZNDqWmKdLa,Jubin Nautiyal,https://open.spotify.com/artist/1tqysapcCh1lWEAc9dIFpa,2023-05-25,250457,2022-05-30,"Hits, repackaged by Bollywood. Cover - Badrinath Ki Dulhania",Bollywood 2.O
Koi Sehri Babu,https://open.spotify.com/track/7l1KhSsLVMtWlt8xyQ7fqZ,Koi Sehri Babu - Single,https://open.spotify.com/album/296gFUas5REjQtukjEWYmT,Shruti Rane,https://open.spotify.com/artist/69vXsJLW99gZRgxntkmPop,2022-07-04,175728,2022-05-30,"Hits, repackaged by Bollywood. Cover - Badrinath Ki Dulhania",Bollywood 2.O
Koi Sehri Babu,https://open.spotify.com/track/4pjNLUPTbKzWpLv2oNuPAf,Koi Sehri Babu,https://open.spotify.com/album/7eG1s1pv8gCDpf2QBUDxBp,"Shruti Rane, Bombay Raja","https://open.spotify.com/artist/69vXsJLW99gZRgxntkmPop, https://open.spotify.com/artist/29l9D1rcb98ebsSgk90vlH",2022-05-24,175728,2022-05-30,"Hits, repackaged by Bollywood. Cover - Badrinath Ki Dulhania",Bollywood 2.O
Kudi Meri,https://open.spotify.com/track/5OklapYOB69owATMsuexTZ,Kudi Meri,https://open.spotify.com/album/1MHDArVKe5L3L79QQYlp0K,"Dhvani Bhanushali, Yash Narvekar, Lijo George-Dj Chetas","https://open.spotify.com/artist/1OPqAyxsQc8mcRmoNBAnVk, https://open.spotify.com/artist/4RlnRVxKm3jnUzOP4czbIK, https://open.spotify.com/artist/5TNSXFCNwlq2CfiMcNOCDP",2022-12-01,247578,2022-05-30,"Hits, repackaged by Bollywood. Cover - Badrinath Ki Dulhania",Bollywood 2.O
"Kudiye Ni Tere (From ""Starfish"")",https://open.spotify.com/track/2OfjwjT2pRe9Yoee7jJECa,"Kudiye Ni Tere (From ""Starfish"")",https://open.spotify.com/album/5bEPoKG9eicPrtuyYSayoI,"Yo Yo Honey Singh, Khaalif, Harjot Kaur","https://open.spotify.com/artist/7uIbLdzzSEqnX0Pkrb56cR, https://open.spotify.com/artist/43wfBC2EqzE6jLYg4rf1gD, https://open.spotify.com/artist/4xPHVHq5B7BX0h8XCOYWQw",2023-11-18,249105,2022-05-30,"Hits, repackaged by Bollywood. Cover - Badrinath Ki Dulhania",Bollywood 2.O
Kya Karte The Saajna,https://open.spotify.com/track/0wpnPKFKnbiT609ch7nC1X,Shubh Mangal Zyada Saavdhan,https://open.spotify.com/album/1qvic7ic93zptwsWs2nvhU,"Zahrah S Khan, Anuradha Paudwal","https://open.spotify.com/artist/7C5xVXoqim1TICnCMZ9A6P, https://open.spotify.com/artist/4hkB2bR5ek6lJChj6aunCn",2022-05-24,168645,2022-05-30,"Hits, repackaged by Bollywood. Cover - Badrinath Ki Dulhania",Bollywood 2.O
Kya Yehi Pyaar Hai,https://open.spotify.com/track/76oTKi1zvsDawQWmzT5inJ,Kya Yehi Pyaar Hai,https://open.spotify.com/album/3ggLZcyGm284eFb60hzVbW,"Amaal Mallik, Armaan Malik, R. D. Burman","https://open.spotify.com/artist/76fuWYgIf3TVIopTs3vaJ6, https://open.spotify.com/artist/4IKVDbCSBTxBeAsMKjAuTs, https://open.spotify.com/artist/2JSYASbWU5Y0fVpts3Eq7g",2022-05-24,335272,2022-05-30,"Hits, repackaged by Bollywood. Cover - Badrinath Ki Dulhania",Bollywood 2.O
"Kyaa Baat Haii 2.0 (From ""Govinda Naam Mera"")",https://open.spotify.com/track/3SxOgJihDKlbZ9C1OvLgNs,"Kyaa Baat Haii 2.0 (From ""Govinda Naam Mera"")",https://open.spotify.com/album/2WGf3hNRhDAbcI29cAFolO,"Harrdy Sandhu, Tanishk Bagchi, Nikhita Gandhi, Jaani","https://open.spotify.com/artist/4ITkqBlf5eoVCOFwsJCnqo, https://open.spotify.com/artist/4f7KfxeHq9BiylGmyXepGt, https://open.spotify.com/artist/3tPQOjkxO3mrYrrgkTeXgH, https://open.spotify.com/artist/5gZhfbckaWo89OzDSk3gdT",2022-12-06,176170,2022-05-30,"Hits, repackaged by Bollywood. Cover - Badrinath Ki Dulhania",Bollywood 2.O
"Laal Peeli Akhiyaan (From ""Teri Baaton Mein Aisa Uljha Jiya"")",https://open.spotify.com/track/2ibipg9GBEZ5YKOdskobJZ,"Laal Peeli Akhiyaan (From ""Teri Baaton Mein Aisa Uljha Jiya"")",https://open.spotify.com/album/0DfZ5sQoVE4yNpo1ofnZRv,"Tanishk Bagchi, Romy, Neeraj Rajawat","https://open.spotify.com/artist/4f7KfxeHq9BiylGmyXepGt, https://open.spotify.com/artist/0bRPtPZQkWHeG7MGk9eWlh, https://open.spotify.com/artist/3yjKvP7LiyIw2dzB5CCGxM",2024-01-12,188101,2022-05-30,"Hits, repackaged by Bollywood. Cover - Badrinath Ki Dulhania",Bollywood 2.O
Leja Re,https://open.spotify.com/track/68iBMrMRc1rg4eAxJbvxch,Leja Re,https://open.spotify.com/album/3Qx3ApbCoc45FxqRVkty7E,"Tanishk Bagchi, Dhvani Bhanushali, Rashmi Virag","https://open.spotify.com/artist/4f7KfxeHq9BiylGmyXepGt, https://open.spotify.com/artist/1OPqAyxsQc8mcRmoNBAnVk, https://open.spotify.com/artist/5r2baeTwcCJnuIsDIlxUJo",2022-05-24,205974,2022-05-30,"Hits, repackaged by Bollywood. Cover - Badrinath Ki Dulhania",Bollywood 2.O
Leke Pehla Pehla Pyaar,https://open.spotify.com/track/6dWGI5eCRp1ZXmD3cF1wtu,Kya Meri Sonam Gupta Bewafa Hai? (Original Motion Picture Soundtrack),https://open.spotify.com/album/1jeWWC9f4BULAlp8F7zMCQ,"Jassie Gill, Simar Kaur","https://open.spotify.com/artist/3xZnxcyeC0vVaJvEA9VqrA, https://open.spotify.com/artist/5yI5MjFLwQwfP24OxchqN1",2022-07-04,174264,2022-05-30,"Hits, repackaged by Bollywood. Cover - Badrinath Ki Dulhania",Bollywood 2.O
Leke Pehla Pehla Pyaar,https://open.spotify.com/track/0wfzE2CNf5Bz2M93N71mmQ,Kya Meri Sonam Gupta Bewafa Hai,https://open.spotify.com/album/7GFu2Shw56GA5VVm2qY1np,"Jassie Gill, Simar Kaur, Avvy Sra","https://open.spotify.com/artist/3xZnxcyeC0vVaJvEA9VqrA, https://open.spotify.com/artist/5yI5MjFLwQwfP24OxchqN1, https://open.spotify.com/artist/4qjiRRFcM4WZ0aJ3IHdWPN",2022-05-24,174264,2022-05-30,"Hits, repackaged by Bollywood. Cover - Badrinath Ki Dulhania",Bollywood 2.O
"Leke Pehla Pehla Pyaar (From ""Kya Meri Sonam Gupta Bewafa Hai?"")",https://open.spotify.com/track/57gcO6spcJ3QoXuW68QYsL,"Leke Pehla Pehla Pyaar (From ""Kya Meri Sonam Gupta Bewafa Hai?"") - Single",https://open.spotify.com/album/4LREyuKsytOod1nosFcSe7,"Jassie Gill, Simar Kaur, O. P. Nayyar, Avvy Sra","https://open.spotify.com/artist/3xZnxcyeC0vVaJvEA9VqrA, https://open.spotify.com/artist/5yI5MjFLwQwfP24OxchqN1, https://open.spotify.com/artist/5uL7cXOFYlR78lgS08tkBL, https://open.spotify.com/artist/1vKd2cgDOiLcV5YA5uy7GG",2022-07-04,174264,2022-05-30,"Hits, repackaged by Bollywood. Cover - Badrinath Ki Dulhania",Bollywood 2.O
Madhaniyan,https://open.spotify.com/track/0L0EHuJRqIbEnEc1hPSmhg,Starfish,https://open.spotify.com/album/1U83oaOX9s4WfrrzF45shm,Manan Bhardwaj,https://open.spotify.com/artist/3pQ4aA7dkolyjUAMrVScgh,2023-11-24,215092,2022-05-30,"Hits, repackaged by Bollywood. Cover - Badrinath Ki Dulhania",Bollywood 2.O
"Main Khiladi - From ""Selfiee""",https://open.spotify.com/track/7E0A86Yhc0ZyOl6aAPE5wN,"Main Khiladi (From ""Selfiee"")",https://open.spotify.com/album/7MFOyviMDG0SSRDOUbFnki,"Tanishk Bagchi, Anu Malik, Abhijeet","https://open.spotify.com/artist/4f7KfxeHq9BiylGmyXepGt, https://open.spotify.com/artist/71hjb5G92mGoKRSAW3Cj00, https://open.spotify.com/artist/2ZRrPOjBIWoKK5rHedLijj",2023-02-01,187099,2022-05-30,"Hits, repackaged by Bollywood. Cover - Badrinath Ki Dulhania",Bollywood 2.O
Main Nikla Gaddi Leke,https://open.spotify.com/track/5GCK0hKd4TkMlxM8tFOhQv,Gadar 2 (Original Motion Picture Soundtrack),https://open.spotify.com/album/5Oxg8wfDhPIrEBM9Yz7ilI,"Mithoon, Udit Narayan, Aditya Narayan, Anand Bakshi","https://open.spotify.com/artist/09UmIX92EUH9hAK4bxvHx6, https://open.spotify.com/artist/70B80Lwx2sxti0M1Ng9e8K, https://open.spotify.com/artist/4Z0t0LHjOjFRiv0mjBw206, https://open.spotify.com/artist/3Bku4b0uiR8KJSXu7U8Iyy",2023-11-24,230281,2022-05-30,"Hits, repackaged by Bollywood. Cover - Badrinath Ki Dulhania",Bollywood 2.O
Maine Tujhko Dekha,https://open.spotify.com/track/6TeQwZim9noPvf96kNwldZ,"Maine Tujhko Dekha (From ""Golmaal Again!!!"")",https://open.spotify.com/album/6X3W05CyGiCL8pQ1GUKY7F,"Neeraj Shridhar, Sukriti Kakar, Amaal Mallik","https://open.spotify.com/artist/3tHD07u1ON4uHxmnT9rwqZ, https://open.spotify.com/artist/3FgHkfb3IqG4WKuVe1xCXM, https://open.spotify.com/artist/76fuWYgIf3TVIopTs3vaJ6",2022-05-24,207393,2022-05-30,"Hits, repackaged by Bollywood. Cover - Badrinath Ki Dulhania",Bollywood 2.O
Mangta Hai Kya,https://open.spotify.com/track/74a2u5OqEtJwFnF5FJFTDj,Mangta Hai Kya,https://open.spotify.com/album/7owXwsIYmZyqLZLc4bP9cn,"Aditya Narayan, Deeksha Toor","https://open.spotify.com/artist/4Z0t0LHjOjFRiv0mjBw206, https://open.spotify.com/artist/1vtqfNWgqE0nTEGXHr8dph",2022-05-24,194545,2022-05-30,"Hits, repackaged by Bollywood. Cover - Badrinath Ki Dulhania",Bollywood 2.O
"Mann Bharryaa 2.0 (From ""Shershaah"")",https://open.spotify.com/track/3jf5303mzzJ96O8xFTcEn4,"Mann Bharryaa 2.0 (From ""Shershaah"")",https://open.spotify.com/album/37nWpT1gls52Tu6pymuPw3,B Praak,https://open.spotify.com/artist/56SjZARoEvag3RoKWIb16j,2022-05-24,266005,2022-05-30,"Hits, repackaged by Bollywood. Cover - Badrinath Ki Dulhania",Bollywood 2.O
Masakali 2.0,https://open.spotify.com/track/0LtuveFgRP4lkksywmCtxV,Masakali 2.0,https://open.spotify.com/album/3L6dmxmI1skvIIXhtzIiG2,"Tulsi Kumar, Sachet Tandon, Mohit Chauhan, A.R. Rahman, Tanishk Bagchi","https://open.spotify.com/artist/0T1CMVkqffHlqEk4BcAph1, https://open.spotify.com/artist/6WOdPJmexxFINcKMkP2jMG, https://open.spotify.com/artist/5GnnSrwNCGyfAU4zuIytiS, https://open.spotify.com/artist/1mYsTxnqsietFxj1OgoGbG, https://open.spotify.com/artist/4f7KfxeHq9BiylGmyXepGt",2022-05-24,172014,2022-05-30,"Hits, repackaged by Bollywood. Cover - Badrinath Ki Dulhania",Bollywood 2.O
Mere Angne Mein,https://open.spotify.com/track/4jnu5AGBIup4j0gm1v13f2,Mere Angne Mein,https://open.spotify.com/album/5kpWz0H1f704XmsdQ3RYa5,"Neha Kakkar, Raja Hasan, Tanishk Bagchi","https://open.spotify.com/artist/5f4QpKfy7ptCHwTqspnSJI, https://open.spotify.com/artist/6ID2zdEFxXLChwiqQzf3ZA, https://open.spotify.com/artist/4f7KfxeHq9BiylGmyXepGt",2022-05-24,187953,2022-05-30,"Hits, repackaged by Bollywood. Cover - Badrinath Ki Dulhania",Bollywood 2.O
Mere Humsafar,https://open.spotify.com/track/2g4xCC14UGf1wKLbH7cX5E,All Is Well,https://open.spotify.com/album/3S1BugpQSQCQDJunUmY0uM,"Mithoon, Tulsi Kumar","https://open.spotify.com/artist/09UmIX92EUH9hAK4bxvHx6, https://open.spotify.com/artist/0T1CMVkqffHlqEk4BcAph1",2023-05-25,352785,2022-05-30,"Hits, repackaged by Bollywood. Cover - Badrinath Ki Dulhania",Bollywood 2.O
