track_name,track_url,album_name,album_url,artist_name,artist_url,date_added,duration_ms,date_first_scraped,description,playlist_name
Méditation from Thais: Méditation from Thaïs,https://open.spotify.com/track/0KlIneacGxTLlHdBoEDEqq,Méditation from Thaïs,https://open.spotify.com/album/2YATaeOKuKcIReaB3ctReO,"Jules Massenet, Johan Dalene, Peter Friis Johansson","https://open.spotify.com/artist/1AoIc5YFH0aSFc4mKqBEeB, https://open.spotify.com/artist/6bzcYpT0W1fheZys2ApYBz, https://open.spotify.com/artist/7dKEFIMUAdgkuDw5XcEIUD",2024-09-27,312933,2022-04-19,Uplifting classical melodies to help you rise and shine.,Morning Classical
"Nocturne No. 1 in E Flat Major, H.24",https://open.spotify.com/track/2Sekh56UlBXazbnPppSZvn,Working from Home Classical,https://open.spotify.com/album/1Ot45u8vTs7z6QH7emCCGp,Elizabeth Joy Roe,https://open.spotify.com/artist/5vJAuQf7YI4bRYev7UfZDs,2022-05-27,221731,2022-04-19,Uplifting classical melodies to help you rise and shine.,Morning Classical
"Nocturne No. 1 in E Flat Major, H.24",https://open.spotify.com/track/4h4py9AzEuUGBTJZO4ifnm,Field: Complete Nocturnes,https://open.spotify.com/album/0I3BvDSNoPQnI8Fsr60Cub,"John Field, Elizabeth Joy Roe","https://open.spotify.com/artist/7vDYlejWEU6Yuw4MxTiv56, https://open.spotify.com/artist/5vJAuQf7YI4bRYev7UfZDs",2022-05-27,221731,2022-04-19,Uplifting classical melodies to help you rise and shine.,Morning Classical
"Nocturne No.1 in E Flat Major, H.24",https://open.spotify.com/track/2BoGqeQPudKngGagsPjSJW,Field: Complete Nocturnes,https://open.spotify.com/album/4hPBofF8PnhqMtoHVjS9FN,"John Field, Elizabeth Joy Roe","https://open.spotify.com/artist/7vDYlejWEU6Yuw4MxTiv56, https://open.spotify.com/artist/5vJAuQf7YI4bRYev7UfZDs",2022-02-04,221731,2022-04-19,Uplifting classical melodies to help you rise and shine.,Morning Classical
"Nocturnes, Op. 32: II. Lento (Arr. for Cello & Piano by Julian Riem)",https://open.spotify.com/track/3RvexCDfYTRsgCT0ARvQjU,"Nocturnes, Op. 32: II. Lento (Arr. for Cello & Piano by Julian Riem)",https://open.spotify.com/album/3iBfUE6leu0JLP8zpPhr1N,"Frédéric Chopin, Olga Scheps, Raphaela Gromes","https://open.spotify.com/artist/7y97mc3bZRFXzT2szRM4L4, https://open.spotify.com/artist/07Nqz7k5QdR10iuTJkd6Mp, https://open.spotify.com/artist/1MBdqvpYGau9IvRqwsSS50",2024-03-15,165149,2022-04-19,Uplifting classical melodies to help you rise and shine.,Morning Classical
"Nocturnes, Op. 9",https://open.spotify.com/track/6ueTTzezzvpDXTYeusqNoB,Best of Chopin,https://open.spotify.com/album/7tdNJVuUd9kgumyuXN5nqX,"Frédéric Chopin, Abbey Simon","https://open.spotify.com/artist/7y97mc3bZRFXzT2szRM4L4, https://open.spotify.com/artist/1WZfpyMXeelpNlFlQxVfqI",2022-02-04,284086,2022-04-19,Uplifting classical melodies to help you rise and shine.,Morning Classical
Noktúrna - Upright Piano,https://open.spotify.com/track/0uSyj4g5Qh5zCcbyMJufbY,Noktúrna Variations,https://open.spotify.com/album/26z4j76XfqW15DPpGXEx3D,Gabríel Ólafs,https://open.spotify.com/artist/1vYrIm6O7VtBGszIWe75mB,2023-09-22,122000,2022-04-19,Uplifting classical melodies to help you rise and shine.,Morning Classical
Nuvole Bianche,https://open.spotify.com/track/3weNRklVDqb4Rr5MhKBR3D,Una Mattina,https://open.spotify.com/album/0Ryad9M1b1MxSjgXdHCh1c,Ludovico Einaudi,https://open.spotify.com/artist/2uFUBdaVGtyMqckSeCl0Qj,2024-09-05,357706,2022-04-19,Uplifting classical melodies to help you rise and shine.,Morning Classical
"Oboe Concerto in C Major, K. 314: II. Adagio non troppo",https://open.spotify.com/track/39Msge9Ii3X14GUuoAjdfk,"Mozart: Oboe Concerto in C Major, K. 314: II. Adagio non troppo",https://open.spotify.com/album/5GymNwQR1TLH6HoYcuLAeT,"Wolfgang Amadeus Mozart, Ivan Podyomov, Il Pomo D'oro, Maxim Emelyanychev","https://open.spotify.com/artist/4NJhFmfw43RLBLjQvxDuRS, https://open.spotify.com/artist/4zuOEDpzkD6u19mCxQ2LzL, https://open.spotify.com/artist/5a3D9f58cCv9klOc1cAG9z, https://open.spotify.com/artist/36CgM42AtIA5SEne7Wou7q",2023-09-22,425466,2022-04-19,Uplifting classical melodies to help you rise and shine.,Morning Classical
"On Wings of Song, Op. 34 No. 2",https://open.spotify.com/track/2vateCLI3wCUjrVnm9xE2l,Song without Words - Mendelssohn Works,https://open.spotify.com/album/0zcFfaAbwrcKqGhx2RTISW,"Felix Mendelssohn, Haruma Sato, 久末 航","https://open.spotify.com/artist/6MF58APd3YV72Ln2eVg710, https://open.spotify.com/artist/3H65pWTCUa1pcpNVq8HNuk, https://open.spotify.com/artist/4F682tC1bLChNJpYReJL78",2023-04-14,172186,2022-04-19,Uplifting classical melodies to help you rise and shine.,Morning Classical
"Peer Gynt, Op. 23, Act IV: No. 13, Prelude. Morning Mood",https://open.spotify.com/track/5CXtWLiyWfxNFz7J7oHbMl,Grieg: Peer Gynt (Complete Incidental Music),https://open.spotify.com/album/2tDISkhmARbjVfMT4YZ4bz,"Edvard Grieg, San Francisco Symphony, Herbert Blomstedt","https://open.spotify.com/artist/5ihY290YPGc3aY2xTyx7Gy, https://open.spotify.com/artist/1qHStDLIc8uV7hvTG6FGRJ, https://open.spotify.com/artist/3H5lFsmGtr8CoZexz2rznB",2024-09-05,259333,2022-04-19,Uplifting classical melodies to help you rise and shine.,Morning Classical
"Piano Sextet in D Major, Op. 110, MWV Q 16: II. Adagio",https://open.spotify.com/track/0kd1EHqEpwaWFKo8fMoyzF,"Piano Sextet in D Major, Op. 110, MWV Q 16: II. Adagio",https://open.spotify.com/album/0kPifhFeDgm5aJzJ1Yh74W,"Felix Mendelssohn, Hiroaki Takenouchi, Members of Sinfonia Cymru","https://open.spotify.com/artist/6MF58APd3YV72Ln2eVg710, https://open.spotify.com/artist/2PkZHdfGnviYLG4WqB5q4M, https://open.spotify.com/artist/4mi47fdEYh02PCeRZRXEa4",2023-04-05,295080,2022-04-19,Uplifting classical melodies to help you rise and shine.,Morning Classical
Polovtsian Dances from Prince Igor (piano arr. by L. Faulkner),https://open.spotify.com/track/7dlMTbloHegihfau1dF9mm,Polovtsian Dances from Prince Igor (piano arr. by L. Faulkner),https://open.spotify.com/album/2cnR6LsauMMTwyY2Huum1G,Luke Faulkner,https://open.spotify.com/artist/2KTBCTcRbjSO03qPsUeqq3,2023-09-22,172758,2022-04-19,Uplifting classical melodies to help you rise and shine.,Morning Classical
Prayer for Peace,https://open.spotify.com/track/5VskXEGqvTljHxO8jcrZEZ,Prayer for Peace,https://open.spotify.com/album/3pShmYSpdSSwoYG2MF8KnO,Gerard Cousins,https://open.spotify.com/artist/3WKXj3RFryJ1fOr8jrj58V,2024-09-27,73280,2022-04-19,Uplifting classical melodies to help you rise and shine.,Morning Classical
Prelude in G Major,https://open.spotify.com/track/70FROKEHubzMxSstCgaZZl,Bach Reworks (Pt. 2),https://open.spotify.com/album/6u7xGWk6antcgjlmnSzqqZ,Víkingur Ólafsson,https://open.spotify.com/artist/0iqgjl0OG3z53PZVIB7ZyD,2022-02-04,234880,2022-04-19,Uplifting classical melodies to help you rise and shine.,Morning Classical
"Puccini: Gianni Schicchi, Act 1: ""O mio babbino caro"" (Lauretta)",https://open.spotify.com/track/18VNXlRteVgchjjqaTKZmm,Un violon à Paris,https://open.spotify.com/album/1lZyDr7mP2qj6jTl8kj9US,"Giacomo Puccini, Renaud Capuçon","https://open.spotify.com/artist/0OzxPXyowUEQ532c9AmHUR, https://open.spotify.com/artist/6ttz1LgWFVgRiNDOjtDb2L",2022-05-27,121013,2022-04-19,Uplifting classical melodies to help you rise and shine.,Morning Classical
"Puccini: Gianni Schicchi, Act 1: ""O mio babbino caro"" (Lauretta)",https://open.spotify.com/track/6CNrNiNm7ryiG2PSw7YUEk,"Un violon à Paris - Wagner: Albumblatt, WWV 94",https://open.spotify.com/album/6hyT0c6Qpyh40AUeJF4EYc,"Giacomo Puccini, Renaud Capuçon","https://open.spotify.com/artist/0OzxPXyowUEQ532c9AmHUR, https://open.spotify.com/artist/6ttz1LgWFVgRiNDOjtDb2L",2022-02-04,121013,2022-04-19,Uplifting classical melodies to help you rise and shine.,Morning Classical
"Rachmaninov: Rhapsody on a Theme of Paganini, Op. 43: Variation XVIII. Andante cantabile",https://open.spotify.com/track/0OytcRbVD7UBJr2BgBMNUj,Souvenirs,https://open.spotify.com/album/3dVenVnBtNXJUB8P59BVw2,"Sergei Rachmaninoff, Gautier Capuçon, Gabriela Montero","https://open.spotify.com/artist/0Kekt6CKSo0m5mivKcoH51, https://open.spotify.com/artist/57ziOSBD3x0PhVbl7MXTgI, https://open.spotify.com/artist/0zn66Km3MeK24VuWUZydgr",2022-02-04,219093,2022-04-19,Uplifting classical melodies to help you rise and shine.,Morning Classical
"Rinaldo, HWV 7: Lascia ch'io pianga (Arr. for Piano)",https://open.spotify.com/track/0dfAHJmRg7JtCbitsageQG,Handel Variations,https://open.spotify.com/album/21lcyOutL6OClPcldmOP3Q,"George Frideric Handel, Martin Stadtfeld","https://open.spotify.com/artist/1QL7yTHrdahRMpvNtn6rI2, https://open.spotify.com/artist/2Habwewg0ZpMr2YWSTANE9",2022-02-04,268000,2022-04-19,Uplifting classical melodies to help you rise and shine.,Morning Classical
"Romeo and Juliette, Op. 64 (Arr. for Viola and Piano by Vadim Borisovsky, Orchestration for Viola and String Orchestra by François Vallières): Introduction",https://open.spotify.com/track/0f4YTikmB09RKwNEjzG17Y,Destins tragiques,https://open.spotify.com/album/4pssVfUS6LWSm0EEKUqcO5,"Sergei Prokofiev, Elvira Misbakhova, I Musici de Montréal, Jean-François Rivest","https://open.spotify.com/artist/4kHtgiRnpmFIV5Tm4BIs8l, https://open.spotify.com/artist/1TmhJmSvk7r0CbIRjMxhcO, https://open.spotify.com/artist/6zB5N5OhPV65PGkh4rPVHK, https://open.spotify.com/artist/4o9zNggXc4KRZoVI9GtcNY",2023-10-13,155840,2022-04-19,Uplifting classical melodies to help you rise and shine.,Morning Classical
Rose Bay,https://open.spotify.com/track/3fXvaNpYYG1S1pla7P71oF,Rose Bay,https://open.spotify.com/album/6EgPZYM69ojeuJdZaHPOJQ,Ludovico Einaudi,https://open.spotify.com/artist/2uFUBdaVGtyMqckSeCl0Qj,2024-10-04,259120,2022-04-19,Uplifting classical melodies to help you rise and shine.,Morning Classical
"Rêverie, CD 76 (Arr. Cullen for Cello and Orchestra)",https://open.spotify.com/track/0wgqbmYhQyoL2TXGzQEg4k,Cello Moods,https://open.spotify.com/album/7i83TEHhrYpSdiemOVqajE,"Claude Debussy, Julian Lloyd Webber, Royal Philharmonic Orchestra, James Judd","https://open.spotify.com/artist/1Uff91EOsvd99rtAupatMP, https://open.spotify.com/artist/1U4pv151m4SgVMg8fXROYp, https://open.spotify.com/artist/0MvSBMGRQJY3mRwIbJsqF1, https://open.spotify.com/artist/3bRgHXc5F81fdXrdh5jpz5",2022-02-04,240000,2022-04-19,Uplifting classical melodies to help you rise and shine.,Morning Classical
"Salut d'amour, Op. 12",https://open.spotify.com/track/4sD0zdU3FKABM6K3mUsYiT,Klassieke Muziek voor Zondagochtend,https://open.spotify.com/album/3dL5xXrW6tsjQNH6rml5Rn,"Edward Elgar, Sol Gabetta, Danish National Symphony Orchestra, Mario Venzago","https://open.spotify.com/artist/430byzy0c5bPn5opiu0SRd, https://open.spotify.com/artist/4XvLzjMwnILZ9YnMHOVMIN, https://open.spotify.com/artist/6kClxEibflIbA231B95OYX, https://open.spotify.com/artist/39lQyvfR8sc6VYCeXMkFsQ",2022-02-04,182186,2022-04-19,Uplifting classical melodies to help you rise and shine.,Morning Classical
"Salut d'amour, Op. 12",https://open.spotify.com/track/5LbcJEbRpu1yTyANcNN2Yq,For Queen & Country,https://open.spotify.com/album/35feERWqIfjJVUCrLwSbK0,"Edward Elgar, Sol Gabetta, Mario Venzago, Danish National Symphony Orchestra","https://open.spotify.com/artist/430byzy0c5bPn5opiu0SRd, https://open.spotify.com/artist/4XvLzjMwnILZ9YnMHOVMIN, https://open.spotify.com/artist/39lQyvfR8sc6VYCeXMkFsQ, https://open.spotify.com/artist/6kClxEibflIbA231B95OYX",2022-05-27,174160,2022-04-19,Uplifting classical melodies to help you rise and shine.,Morning Classical
"Salut d'amour, Op. 12",https://open.spotify.com/track/5Mke4uDfnpMkHAVhYmPuSE,Elgar: Cello Concerto/Dvorak/Respighi,https://open.spotify.com/album/7KJN1NU8YXaMzDvYbijnYP,"Edward Elgar, Sol Gabetta, Mario Venzago, Danish National Symphony Orchestra","https://open.spotify.com/artist/430byzy0c5bPn5opiu0SRd, https://open.spotify.com/artist/4XvLzjMwnILZ9YnMHOVMIN, https://open.spotify.com/artist/39lQyvfR8sc6VYCeXMkFsQ, https://open.spotify.com/artist/6kClxEibflIbA231B95OYX",2022-05-27,182186,2022-04-19,Uplifting classical melodies to help you rise and shine.,Morning Classical
Scarborough Fair (Arr. Parkin for Cello and Guitar),https://open.spotify.com/track/4wlNPczIullwvmwb4x0ltz,Elgar,https://open.spotify.com/album/3PwJLGFcKrecmaRbJQYMSg,"Traditional, Sheku Kanneh-Mason, Plínio Fernandes","https://open.spotify.com/artist/1U5zgr455OGyIkLNXvDdrf, https://open.spotify.com/artist/6OTr0YwLwGdv7mlmX27hRX, https://open.spotify.com/artist/0FK16dJDaoLTqNO9YhawG8",2022-02-04,194533,2022-04-19,Uplifting classical melodies to help you rise and shine.,Morning Classical
"Siciliano (After ""Erbarme dich"" from Matthäus-Passion, BWV 244, No. 39)",https://open.spotify.com/track/5nFCdayR5pAEVvQw7ZAIuQ,Piano Songbook,https://open.spotify.com/album/4kb4g4LErw7g8iooZfxFAF,"Johann Sebastian Bach, Martin Stadtfeld","https://open.spotify.com/artist/5aIqB5nVVvmFsvSdExz408, https://open.spotify.com/artist/2Habwewg0ZpMr2YWSTANE9",2022-02-04,125200,2022-04-19,Uplifting classical melodies to help you rise and shine.,Morning Classical
"Sinfonietta, FP 141: III. Andante cantabile",https://open.spotify.com/track/4vii1l0Y3VZB2IrVkbRSs1,Poulenc: La voix humaine,https://open.spotify.com/album/1ncMb3XT16iUBExxwNuNiY,"Francis Poulenc, Orchestre National de Lille, Alexandre Bloch","https://open.spotify.com/artist/4IAWVxo2fpTBPn6k7GZ3eY, https://open.spotify.com/artist/4tf4qUbwCkHR28VYqcpaUf, https://open.spotify.com/artist/62bapfSobIHcr52G8fAjlG",2023-01-13,406240,2022-04-19,Uplifting classical melodies to help you rise and shine.,Morning Classical
"Sleepers, Awake, BWV 645 (Transcr. for Guitar)",https://open.spotify.com/track/4ov3xGTdYtaIU6wR5O3khY,"J.S. Bach: Sleepers, Awake, BWV 645 (Transcr. for Guitar)",https://open.spotify.com/album/5tQEsGSfmYIHmqCiAhhgnk,"Johann Sebastian Bach, Raphaël Feuillâtre","https://open.spotify.com/artist/5aIqB5nVVvmFsvSdExz408, https://open.spotify.com/artist/7vaRQaj7oIVMzraSzbtSBa",2023-10-06,185533,2022-04-19,Uplifting classical melodies to help you rise and shine.,Morning Classical
Sleeping Lotus,https://open.spotify.com/track/6c7uYlmHJtZPnenPjqG7Ir,Solipsism,https://open.spotify.com/album/2BGvT97OGSAivOsOb5PzMa,Joep Beving,https://open.spotify.com/artist/2VKfXEWzhUi9siHBDTI02Y,2024-09-05,152000,2022-04-19,Uplifting classical melodies to help you rise and shine.,Morning Classical
"Stars of Sand - From ""Trigun""",https://open.spotify.com/track/601dCT51AL4c6JdlRQYaRr,"Stars of Sand (From ""Trigun"")",https://open.spotify.com/album/3WgUeU8tkVAPokG4h62H2s,"Tsuneo Imahori, Alexandra Whittingham","https://open.spotify.com/artist/5pfYZjQ34Czl0aQcWxQSmp, https://open.spotify.com/artist/54UqAWfr4SIdCc5xBapeMM",2024-04-12,209057,2022-04-19,Uplifting classical melodies to help you rise and shine.,Morning Classical
"Suite bergamasque, L. 75: III. Clair de lune",https://open.spotify.com/track/26KykHLogeIep4OrurliDS,"Debussy: Suite bergamasque, L. 75: III. Clair de lune",https://open.spotify.com/album/0y0G5l8ObushJUnTvlgj1O,"Claude Debussy, Daniel Barenboim","https://open.spotify.com/artist/1Uff91EOsvd99rtAupatMP, https://open.spotify.com/artist/78sEozQOEJxzXegUuqRSgH",2022-02-04,263826,2022-04-19,Uplifting classical melodies to help you rise and shine.,Morning Classical
"Symphony No. 2 in E Minor, Op. 27: III. Adagio",https://open.spotify.com/track/5zTWkWlF7rkHOiE7sI6AA6,Rachmaninoff: Symphonies Nos. 2 & 3; Isle of the Dead,https://open.spotify.com/album/2kmcu9Pz6PfNN6BpXxcBKf,"Sergei Rachmaninoff, Philadelphia Orchestra, Yannick Nézet-Séguin","https://open.spotify.com/artist/0Kekt6CKSo0m5mivKcoH51, https://open.spotify.com/artist/6tdexW8bZTG8NgOFUCYQn1, https://open.spotify.com/artist/5ZGyCOrODWwaVtLSDjayl5",2023-06-30,972000,2022-04-19,Uplifting classical melodies to help you rise and shine.,Morning Classical
"Symphony No. 6 in F Major, Op. 68, ""Pastorale"": I. Allegro ma non troppo, ""Awakening of cheerful feelings on arriving in the countryside""",https://open.spotify.com/track/6Ye4niSXscwpj4smkb5ioO,"Beethoven for Three: Symphony No. 6 ""Pastorale"" and Op. 1, No. 3",https://open.spotify.com/album/5ezojM5Z8lU0RPyS52MTlV,"Ludwig van Beethoven, Yo-Yo Ma, Emanuel Ax, Leonidas Kavakos","https://open.spotify.com/artist/2wOqMjp9TyABvtHdOSOTUS, https://open.spotify.com/artist/5Dl3HXZjG6ZOWT5cV375lk, https://open.spotify.com/artist/17yd2V3A2UmwD0a00hmjX5, https://open.spotify.com/artist/16XP6b4v1MdN8UYRBlgVKn",2022-11-11,711626,2022-04-19,Uplifting classical melodies to help you rise and shine.,Morning Classical
The Arts and the Hours,https://open.spotify.com/track/318jLr9oY0UrxYqyUHCfBA,Debussy – Rameau,https://open.spotify.com/album/4oVqtr6UVWx5pCQpoOU6wU,"Víkingur Ólafsson, Jean-Philippe Rameau","https://open.spotify.com/artist/0iqgjl0OG3z53PZVIB7ZyD, https://open.spotify.com/artist/4JSWO1Pf2zV991fq64uAce",2022-02-04,285442,2022-04-19,Uplifting classical melodies to help you rise and shine.,Morning Classical
The Girl with the Flaxen Hair,https://open.spotify.com/track/40jTwi0A7djTFe01Di61Ux,Cello Bouquet,https://open.spotify.com/album/0n0T7E3Ug0OL572o7NGF5W,Hajime Mizoguchi,https://open.spotify.com/artist/37MI19rLgummvAp3PFu945,2022-02-04,182108,2022-04-19,Uplifting classical melodies to help you rise and shine.,Morning Classical
The Seal Lullaby (Arr. Parkin),https://open.spotify.com/track/3jUGfTl7C4fWfImfKMbUoR,Carnival,https://open.spotify.com/album/4YzUUdivf5HOhYSkUADuBM,"Eric Whitacre, Isata Kanneh-Mason, Jeneba Kanneh-Mason, Braimah Kanneh-Mason, Konya Kanneh-Mason, Aminata Kanneh-Mason, Sheku Kanneh-Mason, Mariatu Kanneh-Mason","https://open.spotify.com/artist/5TWpCLIhvGlbJmLK1zNpiL, https://open.spotify.com/artist/7FEzSfCBSOo0wAmdk9pQ6M, https://open.spotify.com/artist/4N1PbaBSiRha6yzEmdwcCZ, https://open.spotify.com/artist/3sNaER8L3Qd0fkdP52pGUV, https://open.spotify.com/artist/1iVdpAhwFutZ7dAknlpFnM, https://open.spotify.com/artist/2SkVtEcR76YKHYZdR2wbjD, https://open.spotify.com/artist/6OTr0YwLwGdv7mlmX27hRX, https://open.spotify.com/artist/6gEI0QXhUgfCl98qna6F8K",2022-02-04,218560,2022-04-19,Uplifting classical melodies to help you rise and shine.,Morning Classical
Three Jamaican Dances: No. 2,https://open.spotify.com/track/67HF6y5o1UhIFUGIOPzUK5,"Senku - Piano Music by Composers of African Descent, Vol. 1",https://open.spotify.com/album/0Ek2MOe3oScb5Fn39c8F57,"Oswald Russell, William Chapman Nyaho","https://open.spotify.com/artist/7wrHPrsAxevxCYYVZa9Vy1, https://open.spotify.com/artist/1MdLO15sS1LDVswSIyOXzo",2022-02-04,147586,2022-04-19,Uplifting classical melodies to help you rise and shine.,Morning Classical
Tomorrow's Song,https://open.spotify.com/track/5OLv8P0JSaXFB95rw5saRv,The Glass Effect (The Music of Philip Glass & Others),https://open.spotify.com/album/1mbU0t4SlphUSX5wlCmIao,"Ólafur Arnalds, Lavinia Meijer","https://open.spotify.com/artist/0PWckrnBHoMK2cWhiRVmvq, https://open.spotify.com/artist/1QpDFI4PxPwdv2E3iS6pCp",2022-02-04,185946,2022-04-19,Uplifting classical melodies to help you rise and shine.,Morning Classical
Violin Concerto in D Major: II. Adagio,https://open.spotify.com/track/40EnGSgqCBuIe3zoHBUWMr,Saint-Georges: Violin Concerto in D Major,https://open.spotify.com/album/5Ec2ImbUEUaBlqxIKGD8vN,"Joseph Boulogne Chevalier de Saint-Georges, Zefira Valova, Il Pomo D'oro","https://open.spotify.com/artist/02onqdkvTxxy6tNJWnjnFU, https://open.spotify.com/artist/56hpaB3bb4ydN9TTTlcWX4, https://open.spotify.com/artist/5a3D9f58cCv9klOc1cAG9z",2022-05-25,268520,2022-04-19,Uplifting classical melodies to help you rise and shine.,Morning Classical
"Waltz No. 19 in A Minor, KK IVb (Version for Harp in A Flat Minor)",https://open.spotify.com/track/7i9cdG6l1lg0xAraTublsw,"Chopin: Waltz No. 19 in A Minor, KK IVb (Version for Harp in A Flat Minor)",https://open.spotify.com/album/0abwlgcTkteYoqF5MdJqvO,"Frédéric Chopin, Magdalena Hoffmann","https://open.spotify.com/artist/7y97mc3bZRFXzT2szRM4L4, https://open.spotify.com/artist/6Rq4dclwT2EHEG8lhvWqBT",2022-02-04,142638,2022-04-19,Uplifting classical melodies to help you rise and shine.,Morning Classical
"Zdes' khorosho ('How Fair This Spot'), Op. 21, No. 7",https://open.spotify.com/track/0wZMPhztIsuwSjCo6OalWe,Reflections,https://open.spotify.com/album/2y9DN1TNj4qMf1H5epuupR,"Sergei Rachmaninoff, Pablo Ferrandez, Denis Kozhukhin","https://open.spotify.com/artist/0Kekt6CKSo0m5mivKcoH51, https://open.spotify.com/artist/0W2xAxxZVRbIhzn5lLMowt, https://open.spotify.com/artist/5iRBqpTEOgggnri1awdnNZ",2022-05-27,119426,2022-04-19,Uplifting classical melodies to help you rise and shine.,Morning Classical
"Zdes' khorosho ('How Fair This Spot'), Op. 21, No. 7",https://open.spotify.com/track/1Hnp1eblIw5zvF4BcmcXl0,"Zdes' khorosho ('How Fair This Spot'), Op. 21, No. 7",https://open.spotify.com/album/6Vgd9LmGN2XFaSmTBEX9oc,"Sergei Rachmaninoff, Pablo Ferrandez, Denis Kozhukhin","https://open.spotify.com/artist/0Kekt6CKSo0m5mivKcoH51, https://open.spotify.com/artist/0W2xAxxZVRbIhzn5lLMowt, https://open.spotify.com/artist/5iRBqpTEOgggnri1awdnNZ",2022-02-04,119426,2022-04-19,Uplifting classical melodies to help you rise and shine.,Morning Classical
エトピリカ,https://open.spotify.com/track/28F2FyLu4pZNLdoWuFZ57Y,Adagio,https://open.spotify.com/album/24eONPwMnnsH5mny2o3AvQ,"Taro Hakase, NH&K TRIO","https://open.spotify.com/artist/6vJFQLD25Df5uZW77gVv0k, https://open.spotify.com/artist/42P4Cf7kljp1XjLtkGcN2H",2023-03-22,222640,2022-04-19,Uplifting classical melodies to help you rise and shine.,Morning Classical
