track_name,track_url,album_name,album_url,artist_name,artist_url,date_added,duration_ms,date_first_scraped,description,playlist_name
Tamma Tamma Again,https://open.spotify.com/track/5sqPE9h98DkO5ms20NUiUg,Badrinath Ki Dulhania,https://open.spotify.com/album/26ska1StQhwbWADLTg2hky,"Bappi Lahiri, Anuradha Paudwal, Badshah","https://open.spotify.com/artist/2jqTyPt0UZGrthPF4KMpeN, https://open.spotify.com/artist/4hkB2bR5ek6lJChj6aunCn, https://open.spotify.com/artist/0y59o4v8uw5crbN9M3JiL1",2022-05-24,199264,2022-05-30,"Hits, repackaged by Bollywood. Cover - Badrinath Ki Dulhania",Bollywood 2.O
"Tenu Lehenga (From ""Satyameva Jayate 2"")",https://open.spotify.com/track/2FlkFn2YRzTQ13Fu2tfHb0,"Tenu Lehenga (From ""Satyameva Jayate 2"")",https://open.spotify.com/album/5tul86eaJyQKvgzoRemZtv,"Tanishk Bagchi, Zahrah S Khan, Jass Manak","https://open.spotify.com/artist/4f7KfxeHq9BiylGmyXepGt, https://open.spotify.com/artist/7C5xVXoqim1TICnCMZ9A6P, https://open.spotify.com/artist/2P9JaCtpbQSuZOgvtPrUJ8",2023-10-25,247048,2022-05-30,"Hits, repackaged by Bollywood. Cover - Badrinath Ki Dulhania",Bollywood 2.O
Tere Bin,https://open.spotify.com/track/4Y1Sd0fSSxHEMrWkd2x3EW,Simmba,https://open.spotify.com/album/3dynRTuVOrAr5O7srr2txN,"Rahat Fateh Ali Khan, Asees Kaur, Tanishk Bagchi","https://open.spotify.com/artist/3OLGltG8UPIea8sA4w0yg0, https://open.spotify.com/artist/1sVmXkzX2ukc6QvasrDBES, https://open.spotify.com/artist/4f7KfxeHq9BiylGmyXepGt",2023-05-25,230948,2022-05-30,"Hits, repackaged by Bollywood. Cover - Badrinath Ki Dulhania",Bollywood 2.O
"Teri Baaton Mein Aisa Uljha Jiya Title Song (From ""Teri Baaton Mein Aisa Uljha Jiya"")",https://open.spotify.com/track/6IR6mzRO60hnMjNoq8rCPE,"Teri Baaton Mein Aisa Uljha Jiya Title Song (From ""Teri Baaton Mein Aisa Uljha Jiya"")",https://open.spotify.com/album/0YCrtSmwjwU1tp5dXtasCJ,"Raghav, Tanishk Bagchi, Asees Kaur","https://open.spotify.com/artist/5PVSEFUT4Inqu3yEq56Ku9, https://open.spotify.com/artist/4f7KfxeHq9BiylGmyXepGt, https://open.spotify.com/artist/1sVmXkzX2ukc6QvasrDBES",2024-01-29,153083,2022-05-30,"Hits, repackaged by Bollywood. Cover - Badrinath Ki Dulhania",Bollywood 2.O
Teri Ore,https://open.spotify.com/track/4f3MLn8DYKvBAkU4NZriLK,Teri Ore,https://open.spotify.com/album/68tWrwi09EqoiQAkoq3NEt,"Deedar Kaur, Krsna Solo","https://open.spotify.com/artist/27XlBHWHNZPLkOU1IdAq6q, https://open.spotify.com/artist/1fn1zda146dVI8wNdqi9l6",2022-05-24,195223,2022-05-30,"Hits, repackaged by Bollywood. Cover - Badrinath Ki Dulhania",Bollywood 2.O
Teri Ore,https://open.spotify.com/track/5NZA85DJUCIVCAd8R7WLKf,Teri Ore,https://open.spotify.com/album/5FAaX17K9rEZDBRUyigQXR,"Deedar Kaur, Krsna Solo","https://open.spotify.com/artist/27XlBHWHNZPLkOU1IdAq6q, https://open.spotify.com/artist/1fn1zda146dVI8wNdqi9l6",2022-07-04,195223,2022-05-30,"Hits, repackaged by Bollywood. Cover - Badrinath Ki Dulhania",Bollywood 2.O
The Jawaani Song,https://open.spotify.com/track/5beP0jhGEjYjd485eBczvZ,The Jawaani Song (Student of the Year 2),https://open.spotify.com/album/61gNyt99QxmFrYp0pFf9Ic,"Vishal-Shekhar, Vishal Dadlani, Payal Dev, Kishore Kumar","https://open.spotify.com/artist/6Mv8GjQa7LKUGCAqa9qqdb, https://open.spotify.com/artist/6CXEwIaXYfVJ84biCxqc9k, https://open.spotify.com/artist/6FtZhorjCMfkaVJ7kKdmq7, https://open.spotify.com/artist/0GF4shudTAFv8ak9eWdd4Y",2022-05-24,253000,2022-05-30,"Hits, repackaged by Bollywood. Cover - Badrinath Ki Dulhania",Bollywood 2.O
The Jawaani Song,https://open.spotify.com/track/3IzQc4KEAFd8lIc90X7FZr,Student of the Year 2 (Original Motion Picture Soundtrack),https://open.spotify.com/album/0j5fpNFJPSBUdkPROtmvFM,"Vishal-Shekhar, Vishal Dadlani, Payal Dev, Kishore Kumar","https://open.spotify.com/artist/6Mv8GjQa7LKUGCAqa9qqdb, https://open.spotify.com/artist/6CXEwIaXYfVJ84biCxqc9k, https://open.spotify.com/artist/6FtZhorjCMfkaVJ7kKdmq7, https://open.spotify.com/artist/0GF4shudTAFv8ak9eWdd4Y",2022-07-04,253160,2022-05-30,"Hits, repackaged by Bollywood. Cover - Badrinath Ki Dulhania",Bollywood 2.O
"Tip Tip (From ""Sooryavanshi"")",https://open.spotify.com/track/5zfRl79umXWvKoA7p4KEPa,"Tip Tip (From ""Sooryavanshi"")",https://open.spotify.com/album/5xhnmuzC2RnvShBs631Q2y,"Udit Narayan, Alka Yagnik","https://open.spotify.com/artist/70B80Lwx2sxti0M1Ng9e8K, https://open.spotify.com/artist/3gBKY0y3dFFVRqicLnVZYz",2022-05-24,250287,2022-05-30,"Hits, repackaged by Bollywood. Cover - Badrinath Ki Dulhania",Bollywood 2.O
"Tip Tip - From ""Lockdown""",https://open.spotify.com/track/69iaaF0VAWOciXqJ2wfe54,"Tip Tip (From ""Lockdown"")",https://open.spotify.com/album/5oDUWgZrLsZvB4PQxffUuO,"Badshah, Jonita Gandhi","https://open.spotify.com/artist/0y59o4v8uw5crbN9M3JiL1, https://open.spotify.com/artist/00sCATpEvwH48ays7PlQFU",2022-05-24,186751,2022-05-30,"Hits, repackaged by Bollywood. Cover - Badrinath Ki Dulhania",Bollywood 2.O
Tu Mile Dil Khile,https://open.spotify.com/track/6SnqFFm7Qp68efuVygvwtU,Tu Mile Dil Khile - Single,https://open.spotify.com/album/5ZdPS2Lm1DvnFwni3DX4pm,"Asees Kaur, Stebin Ben","https://open.spotify.com/artist/1sVmXkzX2ukc6QvasrDBES, https://open.spotify.com/artist/1UAzmnFgjizIDvtHvnCdEq",2023-01-19,197392,2022-05-30,"Hits, repackaged by Bollywood. Cover - Badrinath Ki Dulhania",Bollywood 2.O
"Tum Kya Mile - Shreya's Version (From ""Rocky Aur Rani Kii Prem Kahaani"")",https://open.spotify.com/track/1XF1cPnzsbGYn2mjKUjnWa,"Tum Kya Mile - Shreya's Version (From ""Rocky Aur Rani Kii Prem Kahaani"")",https://open.spotify.com/album/1LsdbOwH1SPB0s5IkII3C1,"Pritam, Shreya Ghoshal, Amitabh Bhattacharya","https://open.spotify.com/artist/1wRPtKGflJrBx9BmLsSwlU, https://open.spotify.com/artist/0oOet2f43PA68X5RxKobEy, https://open.spotify.com/artist/2fMqTqiTxUDlmcOEPaQSsx",2023-07-27,237209,2022-05-30,"Hits, repackaged by Bollywood. Cover - Badrinath Ki Dulhania",Bollywood 2.O
Tum Mile - Refresh Version,https://open.spotify.com/track/1yawKQNxvbLwcsxnMweW6R,Tum Mile (Refresh Version),https://open.spotify.com/album/47SnVKc0ebixbGbzHBVLeH,Anusha Mani,https://open.spotify.com/artist/03yzClwzHK7M7wiQMQixry,2022-05-24,260338,2022-05-30,"Hits, repackaged by Bollywood. Cover - Badrinath Ki Dulhania",Bollywood 2.O
"Tum Par Hum Hai Atke (From ""Pagalpanti"")",https://open.spotify.com/track/0j6LeC4rexb63tw2IaY5Gq,"Tum Par Hum Hai Atke (From ""Pagalpanti"")",https://open.spotify.com/album/7tNwmMdHCQAHCThUbkd652,"Neha Kakkar, Mika Singh, Tanishk Bagchi","https://open.spotify.com/artist/5f4QpKfy7ptCHwTqspnSJI, https://open.spotify.com/artist/5T2I75UlGBcWd5nVyfmL13, https://open.spotify.com/artist/4f7KfxeHq9BiylGmyXepGt",2022-05-24,178619,2022-05-30,"Hits, repackaged by Bollywood. Cover - Badrinath Ki Dulhania",Bollywood 2.O
Udd Jaa Kaale Kaava,https://open.spotify.com/track/2y9cKRYWrbPquZXJGYHbTG,Gadar 2 (Original Motion Picture Soundtrack),https://open.spotify.com/album/5Oxg8wfDhPIrEBM9Yz7ilI,"Mithoon, Udit Narayan, Alka Yagnik, Anand Bakshi","https://open.spotify.com/artist/09UmIX92EUH9hAK4bxvHx6, https://open.spotify.com/artist/70B80Lwx2sxti0M1Ng9e8K, https://open.spotify.com/artist/3gBKY0y3dFFVRqicLnVZYz, https://open.spotify.com/artist/3Bku4b0uiR8KJSXu7U8Iyy",2023-11-24,288428,2022-05-30,"Hits, repackaged by Bollywood. Cover - Badrinath Ki Dulhania",Bollywood 2.O
Urvashi,https://open.spotify.com/track/342pJxy678kgQrZXCL9RG7,Urvashi,https://open.spotify.com/album/7gXEynlmX5QMPN4ZgyxMso,Yo Yo Honey Singh,https://open.spotify.com/artist/7uIbLdzzSEqnX0Pkrb56cR,2022-05-24,215483,2022-05-30,"Hits, repackaged by Bollywood. Cover - Badrinath Ki Dulhania",Bollywood 2.O
Ve Kamleya (Redux),https://open.spotify.com/track/0BYhZuuSAseBCjsbfBDRm9,Rocky Aur Rani Kii Prem Kahaani (Original Motion Picture Soundtrack),https://open.spotify.com/album/1YlugBItLrdu7CEZwRGskr,"TUSHAR JOSHI, Shreya Ghoshal, Amitabh Bhattacharya","https://open.spotify.com/artist/324yz9K4ufBcGkcgUhTiHH, https://open.spotify.com/artist/0oOet2f43PA68X5RxKobEy, https://open.spotify.com/artist/2fMqTqiTxUDlmcOEPaQSsx",2023-09-06,327954,2022-05-30,"Hits, repackaged by Bollywood. Cover - Badrinath Ki Dulhania",Bollywood 2.O
Ve Kamleya (Redux),https://open.spotify.com/track/4gpsM51nvC5TiI2qPjb6P3,Rocky Aur Rani Kii Prem Kahaani (Original Motion Picture Soundtrack),https://open.spotify.com/album/0sS6YgpAosPPZSRgvRawmu,"TUSHAR JOSHI, Shreya Ghoshal, Amitabh Bhattacharya","https://open.spotify.com/artist/324yz9K4ufBcGkcgUhTiHH, https://open.spotify.com/artist/0oOet2f43PA68X5RxKobEy, https://open.spotify.com/artist/2fMqTqiTxUDlmcOEPaQSsx",2023-07-31,327954,2022-05-30,"Hits, repackaged by Bollywood. Cover - Badrinath Ki Dulhania",Bollywood 2.O
What Jhumka ?,https://open.spotify.com/track/16n0AKZ6D5ZhIECp9Chbgb,Rocky Aur Rani Kii Prem Kahaani (Original Motion Picture Soundtrack),https://open.spotify.com/album/0sS6YgpAosPPZSRgvRawmu,"Arijit Singh, Jonita Gandhi, Ranveer Singh, Amitabh Bhattacharya","https://open.spotify.com/artist/4YRxDV8wJFPHPTeXepOstw, https://open.spotify.com/artist/00sCATpEvwH48ays7PlQFU, https://open.spotify.com/artist/0lMa3YTHqQnDDTBaxAV7LK, https://open.spotify.com/artist/2fMqTqiTxUDlmcOEPaQSsx",2023-07-31,213611,2022-05-30,"Hits, repackaged by Bollywood. Cover - Badrinath Ki Dulhania",Bollywood 2.O
"What Jhumka ? (From ""Rocky Aur Rani Kii Prem Kahaani"")",https://open.spotify.com/track/4uNxdQ1L4Xa52MWX864QhW,"What Jhumka ? (From ""Rocky Aur Rani Kii Prem Kahaani"")",https://open.spotify.com/album/2140eUTm2dUfKj1FL7DDAe,"Pritam, Arijit Singh, Jonita Gandhi, Ranveer Singh, Amitabh Bhattacharya, Madan Mohan","https://open.spotify.com/artist/1wRPtKGflJrBx9BmLsSwlU, https://open.spotify.com/artist/4YRxDV8wJFPHPTeXepOstw, https://open.spotify.com/artist/00sCATpEvwH48ays7PlQFU, https://open.spotify.com/artist/0lMa3YTHqQnDDTBaxAV7LK, https://open.spotify.com/artist/2fMqTqiTxUDlmcOEPaQSsx, https://open.spotify.com/artist/5Uvn1P3OFu268QovsUAnDu",2024-03-20,213611,2022-05-30,"Hits, repackaged by Bollywood. Cover - Badrinath Ki Dulhania",Bollywood 2.O
"What Jhumka ? (From ""Rocky Aur Rani Kii Prem Kahaani"")",https://open.spotify.com/track/4QyX8CBSjcoq4iMZuvifyF,"What Jhumka ? (From ""Rocky Aur Rani Kii Prem Kahaani"")",https://open.spotify.com/album/4mrXgKhegKi7Ol4pdN4z3Q,"Pritam, Arijit Singh, Jonita Gandhi, Ranveer Singh, Madan Mohan, Amitabh Bhattacharya","https://open.spotify.com/artist/1wRPtKGflJrBx9BmLsSwlU, https://open.spotify.com/artist/4YRxDV8wJFPHPTeXepOstw, https://open.spotify.com/artist/00sCATpEvwH48ays7PlQFU, https://open.spotify.com/artist/0lMa3YTHqQnDDTBaxAV7LK, https://open.spotify.com/artist/5Uvn1P3OFu268QovsUAnDu, https://open.spotify.com/artist/2fMqTqiTxUDlmcOEPaQSsx",2023-07-12,213611,2022-05-30,"Hits, repackaged by Bollywood. Cover - Badrinath Ki Dulhania",Bollywood 2.O
Whistle Baja 2.0,https://open.spotify.com/track/7MieBhyUfrFfagUdUXGl4q,Whistle Baja 2.0 - Heropanti 2,https://open.spotify.com/album/4smXV3zTl0wOB85RdjFra9,"Neeti Mohan, Mika Singh, A.R. Rahman","https://open.spotify.com/artist/3ZxZ03fj3tXBZHZWzvaLSM, https://open.spotify.com/artist/5T2I75UlGBcWd5nVyfmL13, https://open.spotify.com/artist/1mYsTxnqsietFxj1OgoGbG",2022-05-24,168960,2022-05-30,"Hits, repackaged by Bollywood. Cover - Badrinath Ki Dulhania",Bollywood 2.O
"Whistle Baja 2.0 (From ""Heropanti 2"")",https://open.spotify.com/track/2hVTU41stB2Ahk8bTRhnex,"Whistle Baja 2.0 (From ""Heropanti 2"") - Single",https://open.spotify.com/album/3NzsrJxQHhN3XUb3R19TUR,"Neeti Mohan, Mika Singh, Manj Musik, A.R. Rahman","https://open.spotify.com/artist/3ZxZ03fj3tXBZHZWzvaLSM, https://open.spotify.com/artist/5T2I75UlGBcWd5nVyfmL13, https://open.spotify.com/artist/7IVzXMMN7fFi7PXxPhXcAB, https://open.spotify.com/artist/1mYsTxnqsietFxj1OgoGbG",2022-07-04,168960,2022-05-30,"Hits, repackaged by Bollywood. Cover - Badrinath Ki Dulhania",Bollywood 2.O
"Yaad Reh Jaati Hai (From ""The Buckingham Murders"")",https://open.spotify.com/track/1FJ6IEDugy3WpzUGWuG5fW,"Yaad Reh Jaati Hai (From ""The Buckingham Murders"")",https://open.spotify.com/album/3alRlBz2n3PvARSa6YXasT,"B Praak, Payal Dev, Kunaal Vermaa, Sameer Anjaan, Nadeem Shravan","https://open.spotify.com/artist/56SjZARoEvag3RoKWIb16j, https://open.spotify.com/artist/6FtZhorjCMfkaVJ7kKdmq7, https://open.spotify.com/artist/52XgeWw24o4klNdfwvB0Vx, https://open.spotify.com/artist/5sifufajls8Q6k04Y4F8mH, https://open.spotify.com/artist/0xHXoShMJw3xDArjL8IHtt",2024-09-19,253953,2022-05-30,"Hits, repackaged by Bollywood. Cover - Badrinath Ki Dulhania",Bollywood 2.O
Yai Re,https://open.spotify.com/track/7EH3l7c5HMIHiLm8t0g9ut,Yai Re,https://open.spotify.com/album/3WJyprmm76vrt01oJtBphq,"Yo Yo Honey Singh, Iulia Vantur","https://open.spotify.com/artist/7uIbLdzzSEqnX0Pkrb56cR, https://open.spotify.com/artist/2zLJk6hSb9TMtU8XZ6Ne7t",2022-12-21,245032,2022-05-30,"Hits, repackaged by Bollywood. Cover - Badrinath Ki Dulhania",Bollywood 2.O
Yeh Kaali Kaali Ankhein - Shivam's Version - Recreated Version,https://open.spotify.com/track/5tnmFi0uckbBygluB5CYhU,Yeh Kaali Kaali Ankhein (Music From The Netflix Series),https://open.spotify.com/album/6Ou3S5OJfPdEskgHpAQzsj,"Shivam Sengupta, Anuj Danait, Anu Malik","https://open.spotify.com/artist/3p9iqVv8YUPK53CfSdS9uq, https://open.spotify.com/artist/7m3KZrVTl96hFfzOFwW0aw, https://open.spotify.com/artist/71hjb5G92mGoKRSAW3Cj00",2022-05-24,63157,2022-05-30,"Hits, repackaged by Bollywood. Cover - Badrinath Ki Dulhania",Bollywood 2.O
"Zidd Na Karo (From ""Dedh Bigha Zameen"")",https://open.spotify.com/track/72nKrH0SSbS8yZHPxtPFw2,"Zidd Na Karo (From ""Dedh Bigha Zameen"")",https://open.spotify.com/album/5PGSQxtm27fJpwcWBghdne,"Rochak Kohli, Stebin Ben, Manoj Muntashir","https://open.spotify.com/artist/3dN9MQpjIyNxyeRfz4EDZe, https://open.spotify.com/artist/1UAzmnFgjizIDvtHvnCdEq, https://open.spotify.com/artist/4cAERazLlAzVGA10ORWaUP",2024-05-28,271177,2022-05-30,"Hits, repackaged by Bollywood. Cover - Badrinath Ki Dulhania",Bollywood 2.O
"Zindagi Ki Yehi Reet Hai (From ""Koi Jaane Na"")",https://open.spotify.com/track/45o3NZK6ONVJHGy3g1Yraq,"Zindagi Ki Yehi Reet Hai (From ""Koi Jaane Na"")",https://open.spotify.com/album/3hvI9RVQTPkHDVLeC804Wj,"Soumitra Dev Burman, Rochak Kohli, Laxmikant–Pyarelal","https://open.spotify.com/artist/3533hsqoZQK4EPWhFXpCC7, https://open.spotify.com/artist/3dN9MQpjIyNxyeRfz4EDZe, https://open.spotify.com/artist/3yS84AjNFqhmuJlIXy7sax",2022-05-24,233274,2022-05-30,"Hits, repackaged by Bollywood. Cover - Badrinath Ki Dulhania",Bollywood 2.O
