track_name,track_url,album_name,album_url,artist_name,artist_url,date_added,duration_ms,date_first_scraped,description,playlist_name
"Mere Mehboob Mere Sanam (From ""Bad Newz"")",https://open.spotify.com/track/3yxUi5nDZSWcYKi1C2xmLd,"Mere Mehboob Mere Sanam (From ""Bad Newz"")",https://open.spotify.com/album/2pyoVGd8LlX9pVdkUPyYMt,"Udit Narayan, Alka Yagnik, Anu Malik, Javed Akhtar, Lijo George-Dj Chetas","https://open.spotify.com/artist/70B80Lwx2sxti0M1Ng9e8K, https://open.spotify.com/artist/3gBKY0y3dFFVRqicLnVZYz, https://open.spotify.com/artist/71hjb5G92mGoKRSAW3Cj00, https://open.spotify.com/artist/3UpmjPgIFSGqnxXuiwD014, https://open.spotify.com/artist/5TNSXFCNwlq2CfiMcNOCDP",2024-07-13,182369,2022-05-30,"Hits, repackaged by Bollywood. Cover - Badrinath Ki Dulhania",Bollywood 2.O
"Mirchi Lagi Toh (from ""Coolie No. 1"")",https://open.spotify.com/track/46HqZTCD7Wqd0Q95iuuHmt,"Mirchi Lagi Toh (from ""Coolie No. 1"")",https://open.spotify.com/album/2Nf1dk0hiHHlPoWxm1Ujre,"Kumar Sanu, Alka Yagnik, Anand-Milind, Lijo George, Dj Chetas","https://open.spotify.com/artist/4K6blSRoklNdpw4mzLxwfn, https://open.spotify.com/artist/3gBKY0y3dFFVRqicLnVZYz, https://open.spotify.com/artist/2owjgBZQ70LoCNHIgW3gSk, https://open.spotify.com/artist/4VS3XraXs2LRsowQnQ7VFh, https://open.spotify.com/artist/1jPeDHvfU5Knw8VyOP6TZN",2022-05-24,322442,2022-05-30,"Hits, repackaged by Bollywood. Cover - Badrinath Ki Dulhania",Bollywood 2.O
Mit Jaaye Gham (Dum Maaro Dum),https://open.spotify.com/track/33vhuNbI4A5BcXBYcw9wZx,Dum Maaro Dum,https://open.spotify.com/album/5RM8pIBX8zU9g8U5WG4zfZ,"Pritam, Anushka Manchanda","https://open.spotify.com/artist/1wRPtKGflJrBx9BmLsSwlU, https://open.spotify.com/artist/4K4N32uNO1VRSY4hB7v8kg",2023-05-25,232733,2022-05-30,"Hits, repackaged by Bollywood. Cover - Badrinath Ki Dulhania",Bollywood 2.O
Mundiyan,https://open.spotify.com/track/1gzbyTeCNZkgicRGX9TXl6,Baaghi 2,https://open.spotify.com/album/2zVzYeNSylXPUUungjtXz4,"Navraj Hans, Palak Muchhal","https://open.spotify.com/artist/4ItzUQL1OI4JNDGNdKHR1K, https://open.spotify.com/artist/3yMmYEklQ7gLOZXEFNd3xr",2023-05-25,210183,2022-05-30,"Hits, repackaged by Bollywood. Cover - Badrinath Ki Dulhania",Bollywood 2.O
"Mungda (From ""Total Dhamaal"")",https://open.spotify.com/track/4wc8pPkSIxAirW2FNGp6Pd,"Mungda (From ""Total Dhamaal"") - Single",https://open.spotify.com/album/1J5l9f5rxw0PnaJ8jjNmc9,"Jyotica Tangri, Shaan, Subhro Ganguly, Gourov-Roshin","https://open.spotify.com/artist/5wQDQFm7Ku8WWGi5xqJ9lp, https://open.spotify.com/artist/5cB4d4jPYjMT326sjihQ4m, https://open.spotify.com/artist/1VwpVESJ283CkBcM4IeCBo, https://open.spotify.com/artist/65nLHsd1qvpjrzK4pGbEpC",2022-05-24,196138,2022-05-30,"Hits, repackaged by Bollywood. Cover - Badrinath Ki Dulhania",Bollywood 2.O
"Muqabla (From ""Street Dancer 3D"")",https://open.spotify.com/track/28veUNu4veN0LOBVa0nFw8,"Muqabla (From ""Street Dancer 3D"")",https://open.spotify.com/album/3cK9AtRTNgQNfb2WzyhyYW,"Yash Narvekar, Parampara Tandon, Tanishk Bagchi","https://open.spotify.com/artist/4RlnRVxKm3jnUzOP4czbIK, https://open.spotify.com/artist/1E6arsXf5Fgsnv9YpSzjpE, https://open.spotify.com/artist/4f7KfxeHq9BiylGmyXepGt",2022-05-24,176125,2022-05-30,"Hits, repackaged by Bollywood. Cover - Badrinath Ki Dulhania",Bollywood 2.O
Na Na Na Na Na Re,https://open.spotify.com/track/2wtn3GsCYSPsr3dTWabDXf,Vicky Vidya Ka Woh Wala Video,https://open.spotify.com/album/3B54p8dKa2ehcMhpOmMRcb,"Daler Mehndi, Gurdeep Mehndi, Anand-Milind, Sameer Anjaan","https://open.spotify.com/artist/6wa1AsxB9oJP7lwNSmbcYx, https://open.spotify.com/artist/3ZeKRqvjWodGs3IenNQXio, https://open.spotify.com/artist/2owjgBZQ70LoCNHIgW3gSk, https://open.spotify.com/artist/5sifufajls8Q6k04Y4F8mH",2024-10-11,250078,2022-05-30,"Hits, repackaged by Bollywood. Cover - Badrinath Ki Dulhania",Bollywood 2.O
Naam Hai Mera,https://open.spotify.com/track/1O3OJgr9agQKZCSwKXTw6P,Hate Story Iv,https://open.spotify.com/album/0j4S24oduK76463zMwqy94,Neeti Mohan,https://open.spotify.com/artist/3ZxZ03fj3tXBZHZWzvaLSM,2023-05-25,192221,2022-05-30,"Hits, repackaged by Bollywood. Cover - Badrinath Ki Dulhania",Bollywood 2.O
Najaa,https://open.spotify.com/track/48pqU7LtIkxefpFZJRrNe4,Sooryavanshi,https://open.spotify.com/album/0YByaovkfVAZ9V9XEaIMdT,"Tanishk Bagchi, Pav Dharia, Nikhita Gandhi","https://open.spotify.com/artist/4f7KfxeHq9BiylGmyXepGt, https://open.spotify.com/artist/0j2LQCxHNcJdkuJRa8KEp5, https://open.spotify.com/artist/3tPQOjkxO3mrYrrgkTeXgH",2023-05-25,191239,2022-05-30,"Hits, repackaged by Bollywood. Cover - Badrinath Ki Dulhania",Bollywood 2.O
Nasha (Badshah Version),https://open.spotify.com/track/5qf24Lwp6smv5Oouzl1gOT,Sukhee,https://open.spotify.com/album/55PCdVTvqL3XCkZgdMGJ5V,"Badshah, Chakshu Kotwal, Afsana Khan","https://open.spotify.com/artist/0y59o4v8uw5crbN9M3JiL1, https://open.spotify.com/artist/0w3yzcroyJEGY9nzsseeam, https://open.spotify.com/artist/4z0z82pXirH1TrygipQlOo",2023-09-22,213121,2022-05-30,"Hits, repackaged by Bollywood. Cover - Badrinath Ki Dulhania",Bollywood 2.O
"Nikamma (From ""Nikamma"")",https://open.spotify.com/track/3qgklso41KNlGppAwsJoLq,"Nikamma (From ""Nikamma"")",https://open.spotify.com/album/2ryYKIFNRnysjT2YeeB50c,"Javed-Mohsin, Himesh Reshammiya, Dev Negi, Payal Dev, Deane Sequeira","https://open.spotify.com/artist/2zvJLk0gTH7r7A5Q6X5Bq8, https://open.spotify.com/artist/0sSxphmGskGCKlwB9xa6WU, https://open.spotify.com/artist/04FsFHujpuqonrPXZrEJlK, https://open.spotify.com/artist/6FtZhorjCMfkaVJ7kKdmq7, https://open.spotify.com/artist/1DjoNMVe0jYejgYoGegVzC",2022-05-24,168442,2022-05-30,"Hits, repackaged by Bollywood. Cover - Badrinath Ki Dulhania",Bollywood 2.O
"O Saki Saki (From ""Batla House"")",https://open.spotify.com/track/4cFwhwH5ydnHgB0Tv3lZsm,"O Saki Saki (From ""Batla House"")",https://open.spotify.com/album/0te1B7RLmSG29MBoj0cKzq,"Vishal-Shekhar, Neha Kakkar, Tulsi Kumar, B Praak","https://open.spotify.com/artist/6Mv8GjQa7LKUGCAqa9qqdb, https://open.spotify.com/artist/5f4QpKfy7ptCHwTqspnSJI, https://open.spotify.com/artist/0T1CMVkqffHlqEk4BcAph1, https://open.spotify.com/artist/56SjZARoEvag3RoKWIb16j",2022-05-24,191089,2022-05-30,"Hits, repackaged by Bollywood. Cover - Badrinath Ki Dulhania",Bollywood 2.O
O Yaara Dil Lagana (Reprise),https://open.spotify.com/track/28CYxbE0ZFa5MGiXUQvpJ2,O Yaara Dil Lagana (Reprise),https://open.spotify.com/album/67Ma8JJnU8LAYD25KL3WBU,Aman Mishra Dz,https://open.spotify.com/artist/6PJSrTcXArRvQPwM47KGOW,2022-12-22,190476,2022-05-30,"Hits, repackaged by Bollywood. Cover - Badrinath Ki Dulhania",Bollywood 2.O
Oye Oye,https://open.spotify.com/track/44ohhhvkNX8bpfVTF6V7Tc,Azhar,https://open.spotify.com/album/0V1JQaeLB033XjgS7JqNbP,"Aditi Singh Sharma, Armaan Malik","https://open.spotify.com/artist/4iW4xSfMEIvrXM0Iu3aFDY, https://open.spotify.com/artist/4IKVDbCSBTxBeAsMKjAuTs",2023-05-25,232345,2022-05-30,"Hits, repackaged by Bollywood. Cover - Badrinath Ki Dulhania",Bollywood 2.O
"Papa Kehte Hain (From ""Srikanth"")",https://open.spotify.com/track/7cAdIlAHmaWooLpqzPdTxI,"Papa Kehte Hain (From ""Srikanth"")",https://open.spotify.com/album/1DoM6rYl4oyNaW7sLr8FTP,"Anand-Milind, Udit Narayan, Aditya Dev, Majrooh Sultanpuri","https://open.spotify.com/artist/2owjgBZQ70LoCNHIgW3gSk, https://open.spotify.com/artist/70B80Lwx2sxti0M1Ng9e8K, https://open.spotify.com/artist/2IX6xq1cVcBoD4obUsT5xs, https://open.spotify.com/artist/7ikcALJgPCvpL25820JNYR",2024-04-22,282078,2022-05-30,"Hits, repackaged by Bollywood. Cover - Badrinath Ki Dulhania",Bollywood 2.O
"Pari Hoon Main (From ""Thank You For Coming"")",https://open.spotify.com/track/6ENW5H0OaRbNDESsXljuOb,"Pari Hoon Main (From ""Thank You For Coming"")",https://open.spotify.com/album/3Xdjd6F5JB9EFMXCDbrwLk,"Sunidhi Chauhan, Sushant Divgikar, Rahul Pais, Nariman Khambata, Leslee Lewis, Rajesh Johri","https://open.spotify.com/artist/3eDT9fwXKuHWFvgZaaYC5v, https://open.spotify.com/artist/7a2NKzIrcY9uEhQQbpSpv8, https://open.spotify.com/artist/0iByQOkheGQaW823yagplF, https://open.spotify.com/artist/3kvPoJrBHkhNT8j7Pj8QZN, https://open.spotify.com/artist/42mDOvp3BiaMBM3ae4zWwV, https://open.spotify.com/artist/4Jl8jq6OJfgIj896dVWVn2",2024-03-20,199824,2022-05-30,"Hits, repackaged by Bollywood. Cover - Badrinath Ki Dulhania",Bollywood 2.O
"Pari Hoon Main (From ""Thank You For Coming"")",https://open.spotify.com/track/0yNdiRO3q26Y59qF6etmjD,"Pari Hoon Main (From ""Thank You For Coming"")",https://open.spotify.com/album/7FeW62hoXwElXFoDpMhpCj,"Sushant Divgikar, Rahul Pais, Nariman Khambata, Leslee Lewis","https://open.spotify.com/artist/7a2NKzIrcY9uEhQQbpSpv8, https://open.spotify.com/artist/0iByQOkheGQaW823yagplF, https://open.spotify.com/artist/3kvPoJrBHkhNT8j7Pj8QZN, https://open.spotify.com/artist/42mDOvp3BiaMBM3ae4zWwV",2023-10-20,200540,2022-05-30,"Hits, repackaged by Bollywood. Cover - Badrinath Ki Dulhania",Bollywood 2.O
"Pari Hoon Main (From ""Thank You For Coming"")",https://open.spotify.com/track/38kkFsR56VPFlmMODt15b0,"Pari Hoon Main (From ""Thank You for Coming"")",https://open.spotify.com/album/2cD1CNgsLSqYpxsRtGUy4s,"Sushant Divgikar, Rahul Pais, Nariman Khambata, Leslee Lewis, Rajesh Johri","https://open.spotify.com/artist/7a2NKzIrcY9uEhQQbpSpv8, https://open.spotify.com/artist/0iByQOkheGQaW823yagplF, https://open.spotify.com/artist/3kvPoJrBHkhNT8j7Pj8QZN, https://open.spotify.com/artist/42mDOvp3BiaMBM3ae4zWwV, https://open.spotify.com/artist/4Jl8jq6OJfgIj896dVWVn2",2023-10-20,200540,2022-05-30,"Hits, repackaged by Bollywood. Cover - Badrinath Ki Dulhania",Bollywood 2.O
"Pari Hoon Main (From ""Thank You For Coming)",https://open.spotify.com/track/4351grftIjxdiHySLZYrvS,"Pari Hoon Main (From ""Thank You for Coming)",https://open.spotify.com/album/0BMh0toShdqxdgFU4TOMmA,"Sunidhi Chauhan, Sushant Divgikar, Rahul Pais, Nariman Khambata, Leslee Lewis, Rajesh Johri","https://open.spotify.com/artist/3eDT9fwXKuHWFvgZaaYC5v, https://open.spotify.com/artist/7a2NKzIrcY9uEhQQbpSpv8, https://open.spotify.com/artist/0iByQOkheGQaW823yagplF, https://open.spotify.com/artist/3kvPoJrBHkhNT8j7Pj8QZN, https://open.spotify.com/artist/42mDOvp3BiaMBM3ae4zWwV, https://open.spotify.com/artist/4Jl8jq6OJfgIj896dVWVn2",2023-09-29,199824,2022-05-30,"Hits, repackaged by Bollywood. Cover - Badrinath Ki Dulhania",Bollywood 2.O
"Pasoori Nu (From ""Satyaprem Ki Katha"")",https://open.spotify.com/track/6byRW2mzuc4nBTZ6TN6APu,"Pasoori Nu (From ""Satyaprem Ki Katha"")",https://open.spotify.com/album/201Dk8evzWZR3mscszuC3n,"Arijit Singh, Rochak Kohli, Tulsi Kumar","https://open.spotify.com/artist/4YRxDV8wJFPHPTeXepOstw, https://open.spotify.com/artist/3dN9MQpjIyNxyeRfz4EDZe, https://open.spotify.com/artist/0T1CMVkqffHlqEk4BcAph1",2023-06-26,197171,2022-05-30,"Hits, repackaged by Bollywood. Cover - Badrinath Ki Dulhania",Bollywood 2.O
Patola,https://open.spotify.com/track/7JYzuz3FBHtlRk4xnvWDAg,Blackmail,https://open.spotify.com/album/6eIAx4tyve7NJGmiaFM7Sm,Guru Randhawa,https://open.spotify.com/artist/5rQoBDKFnd1n6BkdbgVaRL,2023-05-25,184410,2022-05-30,"Hits, repackaged by Bollywood. Cover - Badrinath Ki Dulhania",Bollywood 2.O
"Phir Dhan Te Nan (From ""Kuttey"")",https://open.spotify.com/track/201VNiUkMr44r6XbH6Ioz2,"Phir Dhan Te Nan (From ""Kuttey"")",https://open.spotify.com/album/6SfyHk2RY0vbU6UBgtKogg,"Vishal Bhardwaj, Sukhwinder Singh, Vishal Dadlani, Gulzar","https://open.spotify.com/artist/1JdHoZwkwOmX2Pl2iTwnzc, https://open.spotify.com/artist/19MVxKZZdPj2X0F8pi0OCT, https://open.spotify.com/artist/6CXEwIaXYfVJ84biCxqc9k, https://open.spotify.com/artist/0yRC5n90spXG0d3aiDQ0vB",2023-01-05,260148,2022-05-30,"Hits, repackaged by Bollywood. Cover - Badrinath Ki Dulhania",Bollywood 2.O
"Phoolon Ka Taaro Ka (From ""Jigra"")",https://open.spotify.com/track/5p9Ni0WWlyxk7zyStiyMlP,"Phoolon Ka Taaro Ka (From ""Jigra"")",https://open.spotify.com/album/4Y8KvYnq4rTOjANoxX7uTo,"Vedang Raina, Achint, Varun Grover, R. D. Burman, Anand Bakshi","https://open.spotify.com/artist/1X95l2wU2j5wskoTNOwfLB, https://open.spotify.com/artist/4bvGDTEPFnllKiJaEZGuXk, https://open.spotify.com/artist/23tDn4nvBiCQroeeCwwCWT, https://open.spotify.com/artist/2JSYASbWU5Y0fVpts3Eq7g, https://open.spotify.com/artist/3Bku4b0uiR8KJSXu7U8Iyy",2024-09-09,147500,2022-05-30,"Hits, repackaged by Bollywood. Cover - Badrinath Ki Dulhania",Bollywood 2.O
"Poster Lagwa Do (From ""Luka Chuppi"")",https://open.spotify.com/track/5G1H1Im43gBwssOH8XlnNU,"Poster Lagwa Do (From ""Luka Chuppi"")",https://open.spotify.com/album/0NFYKQLV3mjmTvkhjcnLRn,"Mika Singh, Sunanda Sharma, Nikhita Gandhi, White Noise Studios, Dilip Sen- Sameer Sen","https://open.spotify.com/artist/5T2I75UlGBcWd5nVyfmL13, https://open.spotify.com/artist/7AKO4PWJ6ToZVUfA5xmsIY, https://open.spotify.com/artist/3tPQOjkxO3mrYrrgkTeXgH, https://open.spotify.com/artist/4fuqdtyYgRWVK3MszFFptW, https://open.spotify.com/artist/3oEJM6BrpycUL5L8J5YXL5",2022-05-24,178847,2022-05-30,"Hits, repackaged by Bollywood. Cover - Badrinath Ki Dulhania",Bollywood 2.O
Proper Patola,https://open.spotify.com/track/39ujbBjTwwqUFySaCYDMMT,Namaste England (Original Motion Picture Soundtrack),https://open.spotify.com/album/6qokplIH6RyEbm9Q2DiBQB,"Badshah, Diljit Dosanjh, Aastha Gill","https://open.spotify.com/artist/0y59o4v8uw5crbN9M3JiL1, https://open.spotify.com/artist/2FKWNmZWDBZR4dE5KX4plR, https://open.spotify.com/artist/1BYjhAClGpBTLZfics0VRZ",2022-05-24,178604,2022-05-30,"Hits, repackaged by Bollywood. Cover - Badrinath Ki Dulhania",Bollywood 2.O
"Punjabi Munde (From ""Ghudchadi"")",https://open.spotify.com/track/7r8x7Uc5PtyMs0ZOviCWxM,"Punjabi Munde (From ""Ghudchadi"")",https://open.spotify.com/album/0Zj6qRgAjhcK7MTTw7UAf1,"Sukhbir, Lijo George, Tulsi Kumar","https://open.spotify.com/artist/7bcSOvqOKoyZqU41p5YuoJ, https://open.spotify.com/artist/4VS3XraXs2LRsowQnQ7VFh, https://open.spotify.com/artist/0T1CMVkqffHlqEk4BcAph1",2024-07-30,197111,2022-05-30,"Hits, repackaged by Bollywood. Cover - Badrinath Ki Dulhania",Bollywood 2.O
"Pyaar Bhi Jhootha (From ""The Miranda Brothers"")",https://open.spotify.com/track/5TKDYBaz6OuE2Bap9Qau7A,"Pyaar Bhi Jhootha (From ""The Miranda Brothers"")",https://open.spotify.com/album/39iep9wsyPgSk0HfMyYKy3,"Tanishk Bagchi, Yo Yo Honey Singh, B Praak","https://open.spotify.com/artist/4f7KfxeHq9BiylGmyXepGt, https://open.spotify.com/artist/7uIbLdzzSEqnX0Pkrb56cR, https://open.spotify.com/artist/56SjZARoEvag3RoKWIb16j",2024-10-25,171183,2022-05-30,"Hits, repackaged by Bollywood. Cover - Badrinath Ki Dulhania",Bollywood 2.O
"Qismat Badal Di (From ""Yodha"")",https://open.spotify.com/track/30YqoekCI5XuWys0rD9lLL,"Qismat Badal Di (From ""Yodha"")",https://open.spotify.com/album/0OyxPr9bfW719KqosBiMqu,"Ammy Virk, B Praak, Aditya Dev, Jaani","https://open.spotify.com/artist/2RlWC7XKizSOsZ8F3uGi59, https://open.spotify.com/artist/56SjZARoEvag3RoKWIb16j, https://open.spotify.com/artist/2IX6xq1cVcBoD4obUsT5xs, https://open.spotify.com/artist/5gZhfbckaWo89OzDSk3gdT",2024-03-14,309266,2022-05-30,"Hits, repackaged by Bollywood. Cover - Badrinath Ki Dulhania",Bollywood 2.O
"Raabta (Title Track) [From ""Raabta""]",https://open.spotify.com/track/1LvOpTDkOfMZEqkr2fUgrz,Arijit Singh: Love Songs,https://open.spotify.com/album/6LWZ330atfYF43nk7m3pKW,"Arijit Singh, Nikhita Gandhi","https://open.spotify.com/artist/4YRxDV8wJFPHPTeXepOstw, https://open.spotify.com/artist/3tPQOjkxO3mrYrrgkTeXgH",2022-05-24,297158,2022-05-30,"Hits, repackaged by Bollywood. Cover - Badrinath Ki Dulhania",Bollywood 2.O
"Raataan Chill Mix - Spotify Singles (Tanishk Bagchi, Jubin Nautiyal, Hanita Bhambri)",https://open.spotify.com/track/0yIUl79oGZKSYeLY1KEOxP,"Raataan Chill Mix [Spotify Singles (Tanishk Bagchi, Jubin Nautiyal, Hanita Bhambri)]",https://open.spotify.com/album/0GV2kn3m9N9G79IjQkqzEn,"Tanishk Bagchi, Jubin Nautiyal, Hanita Bhambri","https://open.spotify.com/artist/4f7KfxeHq9BiylGmyXepGt, https://open.spotify.com/artist/1tqysapcCh1lWEAc9dIFpa, https://open.spotify.com/artist/3Y5nIabMJLTsWgW6Jqdn7n",2022-05-24,154619,2022-05-30,"Hits, repackaged by Bollywood. Cover - Badrinath Ki Dulhania",Bollywood 2.O
Raataan Lambiyan - Cover By Nikhita Gandhi,https://open.spotify.com/track/0Po3k6o3KGRPOhrs49BROb,Raataan Lambiyan (Cover By Nikhita Gandhi),https://open.spotify.com/album/3adjfeGu72i0IdGkqfHNEA,"Tanishk Bagchi, Nikhita Gandhi","https://open.spotify.com/artist/4f7KfxeHq9BiylGmyXepGt, https://open.spotify.com/artist/3tPQOjkxO3mrYrrgkTeXgH",2023-02-03,139694,2022-05-30,"Hits, repackaged by Bollywood. Cover - Badrinath Ki Dulhania",Bollywood 2.O
Rimjhim Gire Saawan,https://open.spotify.com/track/7Fs0kvk3xXMdufTA1NFZFl,Music Teacher (Original Motion Picture Soundtrack),https://open.spotify.com/album/5chkIczJsQs6S8rNQRIOZx,"Papon, Shreya Ghoshal","https://open.spotify.com/artist/2FPwX3Gh0w4Qr1v3zSTtcT, https://open.spotify.com/artist/0oOet2f43PA68X5RxKobEy",2022-07-04,263020,2022-05-30,"Hits, repackaged by Bollywood. Cover - Badrinath Ki Dulhania",Bollywood 2.O
Rimjhim Gire Saawan,https://open.spotify.com/track/6fZ3OaJywyAGw4Lytc1nkv,Music Teacher,https://open.spotify.com/album/0wSuFl6XVcPuHb9c9cyl4y,"Papon, Shreya Ghoshal, Rochak Kohli, R. D. Burman","https://open.spotify.com/artist/2FPwX3Gh0w4Qr1v3zSTtcT, https://open.spotify.com/artist/0oOet2f43PA68X5RxKobEy, https://open.spotify.com/artist/3dN9MQpjIyNxyeRfz4EDZe, https://open.spotify.com/artist/2JSYASbWU5Y0fVpts3Eq7g",2022-05-24,263020,2022-05-30,"Hits, repackaged by Bollywood. Cover - Badrinath Ki Dulhania",Bollywood 2.O
"Rimjhim Gire Saawan (From ""Music Teacher"")",https://open.spotify.com/track/79AOaYNZj1pD6HYlzZSkc2,"Rimjhim Gire Saawan (From ""Music Teacher"") - Single",https://open.spotify.com/album/0GNKhBjvuUW82bk7MLOKWG,"Papon, Shreya Ghoshal, Rochak Kohli","https://open.spotify.com/artist/2FPwX3Gh0w4Qr1v3zSTtcT, https://open.spotify.com/artist/0oOet2f43PA68X5RxKobEy, https://open.spotify.com/artist/3dN9MQpjIyNxyeRfz4EDZe",2022-07-04,263020,2022-05-30,"Hits, repackaged by Bollywood. Cover - Badrinath Ki Dulhania",Bollywood 2.O
Saari Duniya Jalaa Denge,https://open.spotify.com/track/0YxKKO272sacGBJKjf6FnB,ANIMAL,https://open.spotify.com/album/0a183xiCHiC1GQd8ou7WXO,"Jaani, B Praak","https://open.spotify.com/artist/5gZhfbckaWo89OzDSk3gdT, https://open.spotify.com/artist/56SjZARoEvag3RoKWIb16j",2023-11-25,182348,2022-05-30,"Hits, repackaged by Bollywood. Cover - Badrinath Ki Dulhania",Bollywood 2.O
Saat Samundar Paar,https://open.spotify.com/track/1S2bL4gL6ntqlYgxGLnBXx,Saat Samundar Paar - Single,https://open.spotify.com/album/2A6gzRhCDX7kwyEjmAubI7,"Dev Negi, Nikhita Gandhi, Enbee","https://open.spotify.com/artist/04FsFHujpuqonrPXZrEJlK, https://open.spotify.com/artist/3tPQOjkxO3mrYrrgkTeXgH, https://open.spotify.com/artist/7xUo1I9qmfaWLdnxZlrWIg",2022-07-04,220169,2022-05-30,"Hits, repackaged by Bollywood. Cover - Badrinath Ki Dulhania",Bollywood 2.O
Saat Samundar Paar,https://open.spotify.com/track/5Gq0epZpXXuPg4PQZx1iPG,Saat Samundar Paar,https://open.spotify.com/album/2cHUWpkEmmMiZFC6Z5RNbD,"Dev Negi, Nikhita Gandhi, Enbee, Vivek Kar","https://open.spotify.com/artist/04FsFHujpuqonrPXZrEJlK, https://open.spotify.com/artist/3tPQOjkxO3mrYrrgkTeXgH, https://open.spotify.com/artist/7xUo1I9qmfaWLdnxZlrWIg, https://open.spotify.com/artist/1abe395cgFzPVMgzrI5QHE",2022-05-24,220169,2022-05-30,"Hits, repackaged by Bollywood. Cover - Badrinath Ki Dulhania",Bollywood 2.O
"Sajna Ve Sajna (From ""Vicky Vidya Ka Woh Wala Video"")",https://open.spotify.com/track/2EFi7ey45Za7sxgRZWdmWd,"Sajna Ve Sajna (From ""Vicky Vidya Ka Woh Wala Video"")",https://open.spotify.com/album/4B7opkgPTtlTieFAoJ22u6,"Sunidhi Chauhan, Divya Kumar, Sandesh Shandilya, White Noise Collectives, Irshad Kamil","https://open.spotify.com/artist/3eDT9fwXKuHWFvgZaaYC5v, https://open.spotify.com/artist/0NErdIJtuKBjtxKmlqaWdj, https://open.spotify.com/artist/6AwwLwgIsTIXZ8kHWaZUj5, https://open.spotify.com/artist/73vvjIbxF9MP8VZG3tthUC, https://open.spotify.com/artist/3GdSQUH1BRtl9UrrtuwJlP",2024-10-07,184171,2022-05-30,"Hits, repackaged by Bollywood. Cover - Badrinath Ki Dulhania",Bollywood 2.O
"Sakal Ban (From ""Heeramandi"") - Original",https://open.spotify.com/track/7svwWqUNrqjhlmaHB6Dl3b,"Sakal Ban (From ""Heeramandi"") - Single",https://open.spotify.com/album/5naU4t5jHVZ0Y3bJlWeluh,"Sanjay Leela Bhansali, Raja Hasan","https://open.spotify.com/artist/5eWpthiGD66CLD4bQjvIBp, https://open.spotify.com/artist/6ID2zdEFxXLChwiqQzf3ZA",2024-03-09,150131,2022-05-30,"Hits, repackaged by Bollywood. Cover - Badrinath Ki Dulhania",Bollywood 2.O
Sakhiyan2.0,https://open.spotify.com/track/2hTn8oS49IQULxAWs7hEBz,Sakhiyan2.0 - BellBottom,https://open.spotify.com/album/5iXTBxq6U8TlbjRIDEDItN,"Maninder Buttar, Zahrah S Khan, Tanishk Bagchi","https://open.spotify.com/artist/2sN4fSzAm2rAL0HIurPCEM, https://open.spotify.com/artist/7C5xVXoqim1TICnCMZ9A6P, https://open.spotify.com/artist/4f7KfxeHq9BiylGmyXepGt",2024-03-20,177694,2022-05-30,"Hits, repackaged by Bollywood. Cover - Badrinath Ki Dulhania",Bollywood 2.O
"Sakhiyan2.0 (From ""BellBottom"")",https://open.spotify.com/track/1y5beX4vn7QPfg36r4jiWo,"Sakhiyan2.0 (From ""BellBottom"") - Single",https://open.spotify.com/album/3T7z9uyd25hw8zLcxkS5Yc,"Maninder Buttar, Zara Khan, Tanishk Bagchi","https://open.spotify.com/artist/2sN4fSzAm2rAL0HIurPCEM, https://open.spotify.com/artist/3YVD2aXecw8JQuWkGAuf7t, https://open.spotify.com/artist/4f7KfxeHq9BiylGmyXepGt",2023-05-25,177694,2022-05-30,"Hits, repackaged by Bollywood. Cover - Badrinath Ki Dulhania",Bollywood 2.O
Saregama Carvaan Medley,https://open.spotify.com/track/0ytHk1vxx8zNQLqG3kcGzW,Rocky Aur Rani Kii Prem Kahaani (Original Motion Picture Soundtrack),https://open.spotify.com/album/1YlugBItLrdu7CEZwRGskr,"Shashwat Singh, Jonita Gandhi, Anand Bakshi, Santosh Anand","https://open.spotify.com/artist/6iv4lysB1yHXoZJ2gfqTdh, https://open.spotify.com/artist/00sCATpEvwH48ays7PlQFU, https://open.spotify.com/artist/3Bku4b0uiR8KJSXu7U8Iyy, https://open.spotify.com/artist/2VKSgUyqn6F4mAnsKTonWR",2023-07-31,223727,2022-05-30,"Hits, repackaged by Bollywood. Cover - Badrinath Ki Dulhania",Bollywood 2.O
Saregama Carvaan Medley,https://open.spotify.com/track/7431LoEdYZ0cdjgT2YkRIC,Rocky Aur Rani Kii Prem Kahaani (Original Motion Picture Soundtrack),https://open.spotify.com/album/0sS6YgpAosPPZSRgvRawmu,"Shashwat Singh, Jonita Gandhi, Anand Bakshi, Santosh Anand","https://open.spotify.com/artist/6iv4lysB1yHXoZJ2gfqTdh, https://open.spotify.com/artist/00sCATpEvwH48ays7PlQFU, https://open.spotify.com/artist/3Bku4b0uiR8KJSXu7U8Iyy, https://open.spotify.com/artist/2VKSgUyqn6F4mAnsKTonWR",2023-07-31,223727,2022-05-30,"Hits, repackaged by Bollywood. Cover - Badrinath Ki Dulhania",Bollywood 2.O
Sawan Mein Lag Gayi Aag,https://open.spotify.com/track/6oloWgrErtc8dG2WiV55gn,Ginny Weds Sunny (Original Motion Picture Soundtrack),https://open.spotify.com/album/0uV4f6bZkuwb6BW1dZ3EPC,"Mika Singh, Payal Dev, Neha Kakkar, Badshah","https://open.spotify.com/artist/5T2I75UlGBcWd5nVyfmL13, https://open.spotify.com/artist/6FtZhorjCMfkaVJ7kKdmq7, https://open.spotify.com/artist/5f4QpKfy7ptCHwTqspnSJI, https://open.spotify.com/artist/0y59o4v8uw5crbN9M3JiL1",2022-05-24,226615,2022-05-30,"Hits, repackaged by Bollywood. Cover - Badrinath Ki Dulhania",Bollywood 2.O
"Sheher Ki Ladki (From ""Khandaani Shafakhana"")",https://open.spotify.com/track/24d3IPklAxzBJB2nuWeSpg,"Sheher Ki Ladki (From ""Khandaani Shafakhana"")",https://open.spotify.com/album/4aroXseEbgMQBVvF0SfAHz,"Badshah, Tulsi Kumar, Abhijeet, Chandra Dixit, Tanishk Bagchi, Anand-Milind","https://open.spotify.com/artist/0y59o4v8uw5crbN9M3JiL1, https://open.spotify.com/artist/0T1CMVkqffHlqEk4BcAph1, https://open.spotify.com/artist/2ZRrPOjBIWoKK5rHedLijj, https://open.spotify.com/artist/7yO17B2aZWbkuTh5kpgee4, https://open.spotify.com/artist/4f7KfxeHq9BiylGmyXepGt, https://open.spotify.com/artist/2owjgBZQ70LoCNHIgW3gSk",2022-05-24,172965,2022-05-30,"Hits, repackaged by Bollywood. Cover - Badrinath Ki Dulhania",Bollywood 2.O
"Simroon Tera Naam (From ""Yaariyan 2"")",https://open.spotify.com/track/30Aof6iEIZDwYukcB98AOc,"Simroon Tera Naam (From ""Yaariyan 2"")",https://open.spotify.com/album/6eLhD8tvqlonibwg4g0Blc,"Manan Bhardwaj, Sachet Tandon, Nusrat Fateh Ali Khan","https://open.spotify.com/artist/3pQ4aA7dkolyjUAMrVScgh, https://open.spotify.com/artist/6WOdPJmexxFINcKMkP2jMG, https://open.spotify.com/artist/5HcunTidTUrOaf8V0iJcvl",2023-09-06,258130,2022-05-30,"Hits, repackaged by Bollywood. Cover - Badrinath Ki Dulhania",Bollywood 2.O
"So Gaya Yeh Jahan (From ""Bypass Road"")",https://open.spotify.com/track/6HlKDKcgvwjvWPrYIqMSaK,"So Gaya Yeh Jahan (From ""Bypass Road"")",https://open.spotify.com/album/3iGSnvNeUwTFxoKCE6t4hw,"Nitin Mukesh, Jubin Nautiyal, Saloni Thakkar, Raaj Aashoo","https://open.spotify.com/artist/4ec676jWgAuvEZZg0y7dBy, https://open.spotify.com/artist/1tqysapcCh1lWEAc9dIFpa, https://open.spotify.com/artist/7haLHbJDuh7ZPdFM78PtPg, https://open.spotify.com/artist/3jNaDQZQjbidKVJrIhhibh",2022-05-24,152277,2022-05-30,"Hits, repackaged by Bollywood. Cover - Badrinath Ki Dulhania",Bollywood 2.O
Sunny Sunny 2.O,https://open.spotify.com/track/2BrlVkUZz1bnE7RGF7mFRq,Yaariyan 2,https://open.spotify.com/album/7ae6aMd39gAqmMfaPi9GUY,"Yo Yo Honey Singh, Khaalif, Neha Kakkar","https://open.spotify.com/artist/7uIbLdzzSEqnX0Pkrb56cR, https://open.spotify.com/artist/43wfBC2EqzE6jLYg4rf1gD, https://open.spotify.com/artist/5f4QpKfy7ptCHwTqspnSJI",2023-09-25,214714,2022-05-30,"Hits, repackaged by Bollywood. Cover - Badrinath Ki Dulhania",Bollywood 2.O
