track_name,track_url,album_name,album_url,artist_name,artist_url,date_added,duration_ms,date_first_scraped,description,playlist_name
"""Was mir behagt, ist nur die muntre Jagd"" Cantata, BWV 208: 9. Schafe können sicher weiden (Arr. For Piano Four Hands by Mary Howe)",https://open.spotify.com/track/4JWVkr5jUjylM3hMG5zvXw,Bach,https://open.spotify.com/album/5kKkGS4pzAehXKcvrZEF9M,"Johann Sebastian Bach, Lucas Jussen, Arthur Jussen","https://open.spotify.com/artist/5aIqB5nVVvmFsvSdExz408, https://open.spotify.com/artist/37L0Uo5R9LbpeCQDtlAgtI, https://open.spotify.com/artist/6VLXCeUjBgCPBwa58xUars",2022-02-04,255266,2022-04-19,Uplifting classical melodies to help you rise and shine.,Morning Classical
"12 Klavierstücke für kleine und große Kinder, Op. 85: No. 12, Abendlied (Arr. Rot for Cello and Orchestra)",https://open.spotify.com/track/1C9JF1WWaFTPHx6RUyXyQD,"Schumann: No. 12, Abendlied (Arr. Rot for Cello and Orchestra) from 12 Klavierstücke für kleine und große Kinder, Op. 85",https://open.spotify.com/album/3lw6BZm6JCDGZmgyhEogiK,"Robert Schumann, Kian Soltani, Camerata Salzburg, Gregory Ahss","https://open.spotify.com/artist/2UqjDAXnDxejEyE0CzfUrZ, https://open.spotify.com/artist/6TPa1gvIk1h4Iv1zJ2WUYQ, https://open.spotify.com/artist/2YVKCFWKG6JdDHKYvbEljE, https://open.spotify.com/artist/0Hk9W1OFV5tV5idw3IdyhP",2024-09-05,188480,2022-04-19,Uplifting classical melodies to help you rise and shine.,Morning Classical
"12 Songs, Op. 21: V. Lilacs (Transcr. Rachmaninoff for Solo Piano)",https://open.spotify.com/track/4ObQ0m7VUtrgdEwpFeCKua,Rachmaninoff: Préludes; Études-Tableaux; Moments musicaux,https://open.spotify.com/album/5952RUol8Nl7Ihk1zcaUb4,"Sergei Rachmaninoff, Sergei Babayan","https://open.spotify.com/artist/0Kekt6CKSo0m5mivKcoH51, https://open.spotify.com/artist/79gBfLMlUJNdcXv1nc33oK",2022-02-04,181693,2022-04-19,Uplifting classical melodies to help you rise and shine.,Morning Classical
"2 Arabesques, L. 66: No. 1 in E Major",https://open.spotify.com/track/1btSclzWM6mSKy0pFACPCZ,"Debussy, C.: Piano Music (Complete), Vol. 3 - Suite Bergamasque / Children's Corner",https://open.spotify.com/album/4ZckUyXpwtuv6O1S8jbRgM,"Claude Debussy, Jean-Efflam Bavouzet","https://open.spotify.com/artist/1Uff91EOsvd99rtAupatMP, https://open.spotify.com/artist/4BcOHdtzeyl8hX3zUId6hZ",2022-02-04,244106,2022-04-19,Uplifting classical melodies to help you rise and shine.,Morning Classical
"2 Arabesques, L. 66: No. 1 in E Major",https://open.spotify.com/track/2mS2F4fD8rCOdD7uCCUkV3,Debussy: Complete Works for Piano,https://open.spotify.com/album/4GhW2WNxCn55Vp1UjXDYtK,"Claude Debussy, Jean-Efflam Bavouzet","https://open.spotify.com/artist/1Uff91EOsvd99rtAupatMP, https://open.spotify.com/artist/4BcOHdtzeyl8hX3zUId6hZ",2022-05-27,244106,2022-04-19,Uplifting classical melodies to help you rise and shine.,Morning Classical
"5 Stücke im Volkston, Op. 102: II. Langsam",https://open.spotify.com/track/1SkOyiUembPDeyEvFy1p0c,Roots,https://open.spotify.com/album/2XqomEod8q8RhsSF3kll3P,"Robert Schumann, Martin Fröst, Royal Stockholm Philharmonic Orchestra","https://open.spotify.com/artist/2UqjDAXnDxejEyE0CzfUrZ, https://open.spotify.com/artist/3HmzM7c3S5iM1jBG3gl0FF, https://open.spotify.com/artist/5dyKtXKwZmYhlyh9c6UcB0",2022-02-04,190386,2022-04-19,Uplifting classical melodies to help you rise and shine.,Morning Classical
"Abendlied, Op. 85 No. 12 (Arr. Grosvenor)",https://open.spotify.com/track/0nJzrxHup9vkQyc9Eg698s,Schumann & Brahms,https://open.spotify.com/album/4BGkbzqf7R95Ce9lrSzflR,Benjamin Grosvenor,https://open.spotify.com/artist/4imd50KIbHcyrStbIuZswj,2023-04-05,207046,2022-04-19,Uplifting classical melodies to help you rise and shine.,Morning Classical
Aboriginal Lullaby,https://open.spotify.com/track/7cYVvcT0wfBnFE6RDeFRIs,Aboriginal Lullaby,https://open.spotify.com/album/5aMHHjldNmnqUEayrOZGlj,"Traditional, Amy Dickson","https://open.spotify.com/artist/1U5zgr455OGyIkLNXvDdrf, https://open.spotify.com/artist/3jCy6dMGBsf8Bt8fKD11Ty",2022-02-04,113280,2022-04-19,Uplifting classical melodies to help you rise and shine.,Morning Classical
Adoration,https://open.spotify.com/track/6brnswWmZ8Xdf4MWeskofY,Price: Adoration,https://open.spotify.com/album/11pIdn7j8vNhuCto2x6mgS,"Florence Beatrice Price, Randall Goosby, Zhu Wang","https://open.spotify.com/artist/1M9s5TbPcKurMEzvvW0FFH, https://open.spotify.com/artist/1wgIWZ93QjeVdMO6k6Cy6K, https://open.spotify.com/artist/3z5WrAR67znbCVkXjFKM6Q",2022-02-04,218106,2022-04-19,Uplifting classical melodies to help you rise and shine.,Morning Classical
Adoration (Arr. Gray for Violin and Orchestra),https://open.spotify.com/track/6HcBleYKVQIUE7UPjV9v46,Price: Adoration (Arr. Gray for Violin and Orchestra),https://open.spotify.com/album/6NYQGUgBsuLuQjIIUTO6AH,"Florence Beatrice Price, Randall Goosby, Philadelphia Orchestra, Yannick Nézet-Séguin","https://open.spotify.com/artist/1M9s5TbPcKurMEzvvW0FFH, https://open.spotify.com/artist/1wgIWZ93QjeVdMO6k6Cy6K, https://open.spotify.com/artist/6tdexW8bZTG8NgOFUCYQn1, https://open.spotify.com/artist/5ZGyCOrODWwaVtLSDjayl5",2023-04-14,221000,2022-04-19,Uplifting classical melodies to help you rise and shine.,Morning Classical
Adoration (Version for Solo Violin and String Orchestra),https://open.spotify.com/track/1ah3n5wpOQhFQzl9t3qGIu,America,https://open.spotify.com/album/4s9avSHrTQWXFYuEy0IfNZ,"Florence Beatrice Price, Daniel Hope, Zürcher Kammerorchester","https://open.spotify.com/artist/1M9s5TbPcKurMEzvvW0FFH, https://open.spotify.com/artist/59r5UU2HOytn9V5uMZ5Vur, https://open.spotify.com/artist/33cajGDdkhowQ8hiuEucXM",2022-02-04,232000,2022-04-19,Uplifting classical melodies to help you rise and shine.,Morning Classical
Armellodie,https://open.spotify.com/track/3GfDVDXAs3sxsnfYJ2MG9z,Melody,https://open.spotify.com/album/0CWT7zFSzfNHq6mkY9dZxq,Olga Scheps,https://open.spotify.com/artist/07Nqz7k5QdR10iuTJkd6Mp,2022-02-04,280591,2022-04-19,Uplifting classical melodies to help you rise and shine.,Morning Classical
"Berceuse in D-Flat Major, Op. 57",https://open.spotify.com/track/2Fqi28vvtFUjKSCrKGUg4i,"Chopin: Berceuse in D-Flat Major, Op. 57",https://open.spotify.com/album/6lgT7kL3bJEiDmyHTV1YaP,"Frédéric Chopin, Ruth Slenczynska","https://open.spotify.com/artist/7y97mc3bZRFXzT2szRM4L4, https://open.spotify.com/artist/6Z5dtyrb9Z0LgAkwjqMyY1",2022-02-04,339893,2022-04-19,Uplifting classical melodies to help you rise and shine.,Morning Classical
"Berceuse, Op. 16",https://open.spotify.com/track/7sSSQHaGVwm0rNSlI2M7so,"Fauré: Berceuse, Op. 16",https://open.spotify.com/album/3q7lJbflaSLEkDu3h5cazc,"Gabriel Fauré, Cocomi, Niu Niu","https://open.spotify.com/artist/2gClsBep1tt1rv1CN210SO, https://open.spotify.com/artist/76LVGyW3On02K0by9U8YwV, https://open.spotify.com/artist/59coobPsuoo30nDvDa0SOi",2023-10-06,237600,2022-04-19,Uplifting classical melodies to help you rise and shine.,Morning Classical
CANCER “The Caregiver'',https://open.spotify.com/track/0W4vvuPzPSfgiIjXDfbUuB,180°,https://open.spotify.com/album/4hFVZKTMTQHEDrG1bzlEJs,Tony Ann,https://open.spotify.com/artist/6Y1uosuiV7bpiOuCUgibsN,2024-09-05,211694,2022-04-19,Uplifting classical melodies to help you rise and shine.,Morning Classical
"Canon and Gigue in D Major, P 37: I. Canon",https://open.spotify.com/track/1JKtvWIGJb0POMGEvWtQ8V,Air - a baroque journey,https://open.spotify.com/album/7mcePKkJLonpU7l3RFFEwH,"Johann Pachelbel, Daniel Hope, Lorenza Borrani, Lucy Gould, Jonathan Cohen, Kristian Bezuidenhout, Stefan Maass, Stefan Rath","https://open.spotify.com/artist/62TD7509VQIxUe4WpwO0s3, https://open.spotify.com/artist/59r5UU2HOytn9V5uMZ5Vur, https://open.spotify.com/artist/6uDumdUl8JzVq9EV58O0vZ, https://open.spotify.com/artist/4qhXo1SXU9cEWqthc9a12E, https://open.spotify.com/artist/0z6t3buywDCXXWpXnkmH7R, https://open.spotify.com/artist/2Bvd2g06Kz9rkzXaMNEtNK, https://open.spotify.com/artist/4OE0FgmZJ7YXhFGNNyFzP6, https://open.spotify.com/artist/51LkoMpGrtDSAH8JLDwjFG",2022-02-04,220893,2022-04-19,Uplifting classical melodies to help you rise and shine.,Morning Classical
"Capriccio brillant, Op. 22: Andante",https://open.spotify.com/track/05W1GduItsqueo7fja8e6i,Hummel - Weber - Mendelssohn,https://open.spotify.com/album/3wGZgzMRdcYtItW45U51OR,"Felix Mendelssohn, Matthias Kirschnereit, Michael Sanderling, Frankfurt Radio Symphony Orchestra","https://open.spotify.com/artist/6MF58APd3YV72Ln2eVg710, https://open.spotify.com/artist/48puMugH2PJXYjqzkRYlFd, https://open.spotify.com/artist/1kLhJK7xiowRJJwf28NKhZ, https://open.spotify.com/artist/1XoXD9qLXeOBK6CtR2bbZQ",2022-05-27,150321,2022-04-19,Uplifting classical melodies to help you rise and shine.,Morning Classical
"Capriccio brillant, Op. 22: Andante",https://open.spotify.com/track/4UigTQ0R9RUULtmffx1aTw,Mendelssohn: Capriccio brillant,https://open.spotify.com/album/2bh6kVHkHSsrptZhdGaHLP,"Felix Mendelssohn, Matthias Kirschnereit, Michael Sanderling, Frankfurt Radio Symphony Orchestra","https://open.spotify.com/artist/6MF58APd3YV72Ln2eVg710, https://open.spotify.com/artist/48puMugH2PJXYjqzkRYlFd, https://open.spotify.com/artist/1kLhJK7xiowRJJwf28NKhZ, https://open.spotify.com/artist/1XoXD9qLXeOBK6CtR2bbZQ",2022-02-04,150321,2022-04-19,Uplifting classical melodies to help you rise and shine.,Morning Classical
Cavatina,https://open.spotify.com/track/28W5lTZMClVz9fLt6iiaJN,Classic Williams -- Romance of the Guitar,https://open.spotify.com/album/3lXBNgLzlsHOP9lLbepn6b,"Stanley Myers, John C. Williams, String Orchestra","https://open.spotify.com/artist/6l6NgkV6IWYKlRN7jHCQmt, https://open.spotify.com/artist/6mBYeMZZUhJKEvRXagJYzY, https://open.spotify.com/artist/2ur2pK3VjH3wAl4tO1eBGG",2022-02-04,188666,2022-04-19,Uplifting classical melodies to help you rise and shine.,Morning Classical
"Cello Suite No. 1 in G Major, BWV 1007 (Arr. J. Lindberg for Lute): I. Prélude",https://open.spotify.com/track/2MyWitFE32gAgXpGLO6icN,Bach on the Rauwolf Lute,https://open.spotify.com/album/2c5FC7nBqzTp42hrVFrPjZ,"Johann Sebastian Bach, Jakob Lindberg","https://open.spotify.com/artist/5aIqB5nVVvmFsvSdExz408, https://open.spotify.com/artist/75oA7nyJ60AqDyOpB5Jbs9",2022-02-04,159280,2022-04-19,Uplifting classical melodies to help you rise and shine.,Morning Classical
"Cello Suite No. 1 in G Major, BWV 1007 (Arr. J. Lindberg for Lute): I. Prélude",https://open.spotify.com/track/3Tnq7N6LbfGNUSxy0AeqhT,Bach on the Rauwolf Lute,https://open.spotify.com/album/02iwOIsr2EJ7Kl5dillnkP,"Johann Sebastian Bach, Jakob Lindberg","https://open.spotify.com/artist/5aIqB5nVVvmFsvSdExz408, https://open.spotify.com/artist/75oA7nyJ60AqDyOpB5Jbs9",2023-10-13,159280,2022-04-19,Uplifting classical melodies to help you rise and shine.,Morning Classical
Children's Song No. 1 (Arr. for guitar by Forbes Henderson) - Classical Session,https://open.spotify.com/track/6rpfMfLTgzfw7VzebK5Q9u,Corea: Children's Song No. 1,https://open.spotify.com/album/4v9sxGj2nTgRz1FQi2GoXE,"Chick Corea, Sean Shibe","https://open.spotify.com/artist/5olDKSsFhhmwh8UCWwKtpq, https://open.spotify.com/artist/4EFuBkf11kth7fbFXIpre5",2024-04-19,111178,2022-04-19,Uplifting classical melodies to help you rise and shine.,Morning Classical
"Clarinet Quintet, K. 581: III. Menuetto",https://open.spotify.com/track/3PmDjYUOC4AR9lghScYlxs,Mozart & Widmann: Clarinet Quintets,https://open.spotify.com/album/26Avnk2l7oit96ph0OmB2P,"Wolfgang Amadeus Mozart, Jörg Widmann, Hagen Quartett","https://open.spotify.com/artist/4NJhFmfw43RLBLjQvxDuRS, https://open.spotify.com/artist/7drHkRrCNABV4BkAuVF6nu, https://open.spotify.com/artist/4301XXSbiO4YrZZcuyktbB",2023-04-05,442400,2022-04-19,Uplifting classical melodies to help you rise and shine.,Morning Classical
"Concerto Magna Carta: II. Tenderly, with expression",https://open.spotify.com/track/61hIaUSosuQ6K6q72n3U3z,Magna Carta: The Complete Works for Guitar of John Brunning,https://open.spotify.com/album/2KHxWVYq3BDHfwqYmsaoIA,"John Brunning, Xuefei Yang, Royal Liverpool Philharmonic Orchestra, Clark Rundell","https://open.spotify.com/artist/0QXa0zdkSS1OZ4pYCWd5Rx, https://open.spotify.com/artist/0HTpLUNPRxYfmKRrnluHfq, https://open.spotify.com/artist/6I6fmQU7HGrUsCm4B5Nlk3, https://open.spotify.com/artist/3sz82fjwBXhH7AWlkIA4qS",2022-05-27,364600,2022-04-19,Uplifting classical melodies to help you rise and shine.,Morning Classical
"Concerto No. 1 in D Major, BWV 972 (After Vivaldi RV 230): II. Larghetto (Arr. Perroy for Guitar)",https://open.spotify.com/track/2fn7wn7Rl9Lgco3KjeCkJn,"J.S. Bach: Concerto No. 1 in D Major, BWV 972 (After Vivaldi RV 230): II. Larghetto (Arr. Perroy for Guitar)",https://open.spotify.com/album/3jMn0WtRElDtRGAZWkMQoS,"Johann Sebastian Bach, Raphaël Feuillâtre","https://open.spotify.com/artist/5aIqB5nVVvmFsvSdExz408, https://open.spotify.com/artist/7vaRQaj7oIVMzraSzbtSBa",2023-04-05,246680,2022-04-19,Uplifting classical melodies to help you rise and shine.,Morning Classical
Dance: II. Second Movement,https://open.spotify.com/track/2EifgBTEtl2LD4Rocka3ba,Oliver Davis: Dance,https://open.spotify.com/album/3dQQoqksEVb4uKvfQ94qho,"Oliver Davis, Kerenza Peacock, Huw Watkins, Paul Bateman","https://open.spotify.com/artist/3BRizPspINkIYljgzP1x6J, https://open.spotify.com/artist/2oWyRS6YfCVoVKl50eBsAq, https://open.spotify.com/artist/3xgcjXeaaGErogsNHWbYPU, https://open.spotify.com/artist/5V7l2e1oLF7oSzpvdaDenk",2024-09-05,188773,2022-04-19,Uplifting classical melodies to help you rise and shine.,Morning Classical
"Dawn - From ""Pride & Prejudice"" Soundtrack",https://open.spotify.com/track/2k2MprlqkmDMKKOOWGREzW,Pride and Prejudice - OST,https://open.spotify.com/album/5pV86WRRdbyIdK3YkS7rOI,"Dario Marianelli, Jean-Yves Thibaudet","https://open.spotify.com/artist/0s1ec6aPpRZ4DCj15w1EFg, https://open.spotify.com/artist/1Dot4uMsJMx8n1Xi7gAdV6",2022-02-04,158600,2022-04-19,Uplifting classical melodies to help you rise and shine.,Morning Classical
"Deux Arabesques, L. 66, CD 74: I. Première Arabesque",https://open.spotify.com/track/0CKertYAUevycqhVjGuewD,"Debussy: Complete Works for Piano, Vol. 3",https://open.spotify.com/album/01ofr7grBeNmvO5Gh61j4j,"Claude Debussy, Jean-Efflam Bavouzet","https://open.spotify.com/artist/1Uff91EOsvd99rtAupatMP, https://open.spotify.com/artist/4BcOHdtzeyl8hX3zUId6hZ",2022-05-27,244010,2022-04-19,Uplifting classical melodies to help you rise and shine.,Morning Classical
"Dolly Suite, Op. 56: I. Berceuse",https://open.spotify.com/track/3NbAsIxDL0fVgNuCLD152P,Fauré: Dolly Suite; Nocturnes; Barcarolles; Impromptus,https://open.spotify.com/album/1VMXYuxv7jwh3XzPZtoELi,"Gabriel Fauré, Katia Labèque, Marielle Labèque","https://open.spotify.com/artist/2gClsBep1tt1rv1CN210SO, https://open.spotify.com/artist/5Pj7u76MK9VDyzDiAyYPSL, https://open.spotify.com/artist/4Xo09YXm0lIRA80IVUTe09",2022-02-04,176518,2022-04-19,Uplifting classical melodies to help you rise and shine.,Morning Classical
"Dreaming, Op. 15: No. 3",https://open.spotify.com/track/0Xn6e5ktbNOERfNbtjzXtx,Beach: Dreaming,https://open.spotify.com/album/0Rdg6jecKKwrUAoAns7M3l,"Amy Beach, Eline Marlene","https://open.spotify.com/artist/1QeC5GwDENQv78O3PCLeZB, https://open.spotify.com/artist/0er5UNTeA9WvHTujSLfvBC",2024-09-05,372341,2022-04-19,Uplifting classical melodies to help you rise and shine.,Morning Classical
Estrellita (Arr. Abril & Barrueco for Guitar),https://open.spotify.com/track/01yRkgF7l1pdFSCehiI7o9,Ponce: Estrellita (Arr. Abril & Barrueco for Guitar),https://open.spotify.com/album/0ztyoeKvYBlkX64d5W8lKx,"Manuel Ponce, Alexandra Whittingham","https://open.spotify.com/artist/3sam97auWZppQpYU1HWNxK, https://open.spotify.com/artist/54UqAWfr4SIdCc5xBapeMM",2024-02-09,176585,2022-04-19,Uplifting classical melodies to help you rise and shine.,Morning Classical
"Four Seasons Variation (Arr. for Piano from Violin Concerto, RV 297, ""Winter"": II. Largo by Svetoslav Karparov)",https://open.spotify.com/track/7jezOL1bXEUmQtbCKFrmof,Family,https://open.spotify.com/album/1Jnd4ZqS9ev1hT6Fj0JRlP,"Antonio Vivaldi, Olga Scheps","https://open.spotify.com/artist/2QOIawHpSlOwXDvSqQ9YJR, https://open.spotify.com/artist/07Nqz7k5QdR10iuTJkd6Mp",2022-02-04,121246,2022-04-19,Uplifting classical melodies to help you rise and shine.,Morning Classical
"Goldberg Variations, BWV 988: Aria",https://open.spotify.com/track/5bu9A6uphPWg39RC3ZKeku,"Bach: The Goldberg Variations, BWV 988 (1981 Gould Remaster)",https://open.spotify.com/album/1aCpHSQE5ghxibsQ5gkBe0,"Johann Sebastian Bach, Glenn Gould","https://open.spotify.com/artist/5aIqB5nVVvmFsvSdExz408, https://open.spotify.com/artist/13dkPjqmbcchm8cXjEJQeP",2022-02-04,184853,2022-04-19,Uplifting classical melodies to help you rise and shine.,Morning Classical
"Goldberg Variations, BWV 988: Var. 21",https://open.spotify.com/track/7izqT26X2qmMbqiNAQZruO,"J.S. Bach: Goldberg Variations, BWV 988: Var. 21",https://open.spotify.com/album/3jKFKndTaIy2veF3S9Uwld,"Johann Sebastian Bach, Víkingur Ólafsson","https://open.spotify.com/artist/5aIqB5nVVvmFsvSdExz408, https://open.spotify.com/artist/0iqgjl0OG3z53PZVIB7ZyD",2023-09-22,195243,2022-04-19,Uplifting classical melodies to help you rise and shine.,Morning Classical
Guiding Light,https://open.spotify.com/track/1jt4hk4d51pZ8DZl8yMMmG,Truth,https://open.spotify.com/album/3vkgKLIXijInCpJGgeRsaY,Alexis Ffrench,https://open.spotify.com/artist/58R31AvN8JMHM7xkNpVLjX,2022-05-27,197877,2022-04-19,Uplifting classical melodies to help you rise and shine.,Morning Classical
Guiding Light,https://open.spotify.com/track/6DsGXu4Hii9LyNPLexGCwU,Guiding Light,https://open.spotify.com/album/1OsTAPPpJmkQh8uyeZJRfa,Alexis Ffrench,https://open.spotify.com/artist/58R31AvN8JMHM7xkNpVLjX,2022-02-04,197877,2022-04-19,Uplifting classical melodies to help you rise and shine.,Morning Classical
"Harpsichord Concerto No. 4 in A Major, BWV 1055 (Adapted for Oboe d'amore, Strings and Basso continuo): I. Allegro",https://open.spotify.com/track/2tx1OGhwMuaS456NgiuEuP,Bach Generations,https://open.spotify.com/album/5yOf6Z2tkIAkI3q43OAe5L,"Johann Sebastian Bach, Albrecht Mayer, Berliner Barock Solisten","https://open.spotify.com/artist/5aIqB5nVVvmFsvSdExz408, https://open.spotify.com/artist/1Mbvbes7vW2Pg3bWD9aDgW, https://open.spotify.com/artist/7mEuyFgTPiTRgCh3Hzuwsl",2023-08-04,265197,2022-04-19,Uplifting classical melodies to help you rise and shine.,Morning Classical
"Holberg Suite, Op. 40: II. Sarabande (Andante)",https://open.spotify.com/track/4SXNho7ARXRuvxEIXa4uJ0,Grieg: Holberg Suite; Lyric Suite,https://open.spotify.com/album/1svqZTOGQ1yT4t3p5IRDZX,"Edvard Grieg, Gothenburg Symphony Orchestra, Neeme Järvi","https://open.spotify.com/artist/5ihY290YPGc3aY2xTyx7Gy, https://open.spotify.com/artist/1XaPI6thQ3zTKqIU6sCvd2, https://open.spotify.com/artist/5UHZvYJA0aPcJSLYkYAeps",2022-02-04,194946,2022-04-19,Uplifting classical melodies to help you rise and shine.,Morning Classical
In Paradisum,https://open.spotify.com/track/0tIEXct4Pv3TikqvkYR4CM,In Paradisum,https://open.spotify.com/album/7aBPTOIQycGBJDZHGjAV7d,"Gabriel Fauré, Hayato Sumino","https://open.spotify.com/artist/2gClsBep1tt1rv1CN210SO, https://open.spotify.com/artist/1jVpYW7JYxh4mWzrFVjipz",2024-12-23,214293,2022-04-19,Uplifting classical melodies to help you rise and shine.,Morning Classical
"Jesu, Joy of Man's Desiring - Arr. by Alexis Ffrench",https://open.spotify.com/track/2Kn5PauE1nEJxUQlD6N3JF,"Jesu, Joy of Man's Desiring",https://open.spotify.com/album/2pjG5wJxCWKHmZcNcK0mCR,Alexis Ffrench,https://open.spotify.com/artist/58R31AvN8JMHM7xkNpVLjX,2023-04-14,128242,2022-04-19,Uplifting classical melodies to help you rise and shine.,Morning Classical
"Jesu, Joy of Man's Desiring - Arr. by Alexis Ffrench",https://open.spotify.com/track/75pxraYiRRhRn68Kwk4sT3,Peace,https://open.spotify.com/album/21STh457wYrqmeYQlW1Lvw,Alexis Ffrench,https://open.spotify.com/artist/58R31AvN8JMHM7xkNpVLjX,2023-04-14,128242,2022-04-19,Uplifting classical melodies to help you rise and shine.,Morning Classical
"Kinderszenen, Op. 15: No. 1, Von fremden Ländern und Menschen",https://open.spotify.com/track/4vi9pBR7yJhBzGaNu0k1gj,Schumann: Kinderszenen; Arabesque; Fantasie; Träumerei,https://open.spotify.com/album/5OmHBy2Gm6zSt7sihzbEW2,"Robert Schumann, Vladimir Horowitz","https://open.spotify.com/artist/2UqjDAXnDxejEyE0CzfUrZ, https://open.spotify.com/artist/4Ws5hSoABAwvGJ4LhHwHgq",2022-02-04,93386,2022-04-19,Uplifting classical melodies to help you rise and shine.,Morning Classical
"Kinderszenen, Op. 15: Träumerei (Arr. Lewin for Guitar)",https://open.spotify.com/track/2Imxyb3LiuXsDFo7Gq5YDs,"Schumann: Kinderszenen, Op. 15: Träumerei (Arr. Lewin for Guitar)",https://open.spotify.com/album/3dtyRuctasvglDB28bijNg,"Robert Schumann, Miloš Karadaglić","https://open.spotify.com/artist/2UqjDAXnDxejEyE0CzfUrZ, https://open.spotify.com/artist/7jQSqBxct7Aa8b3GsZFkO4",2022-02-04,215800,2022-04-19,Uplifting classical melodies to help you rise and shine.,Morning Classical
Kindness,https://open.spotify.com/track/31vbhWL8EkGGQzqqpCJRJP,Kindness,https://open.spotify.com/album/0q6TkS6KL7l6gjeyoDHtQQ,"Karen LeFrak, Jacques van Tuinen","https://open.spotify.com/artist/7w0W3SxEy226zQlm1eMnXo, https://open.spotify.com/artist/2cJHx9ShBZorTEnZbVv5nz",2024-10-17,69291,2022-04-19,Uplifting classical melodies to help you rise and shine.,Morning Classical
L'Oiseau de feu (1911 Version): X. Khorovod (Ronde) des princesses,https://open.spotify.com/track/6oVBLpHQIR1pSwgBjMOFkO,Stravinsky: L'Oiseau de feu (1911 Version): X. Khorovod (Ronde) des princesses,https://open.spotify.com/album/7EnZm1nR8zwrm3lUSKmmbU,"Igor Stravinsky, Orchestre de Paris, Klaus Mäkelä","https://open.spotify.com/artist/7ie36YytMoKtPiL7tUvmoE, https://open.spotify.com/artist/0iERWmMl3nIvcDxnJsKZBd, https://open.spotify.com/artist/6iGHnrxEjBwhHsZ65HVUiE",2023-03-10,282120,2022-04-19,Uplifting classical melodies to help you rise and shine.,Morning Classical
"Largo in E-Flat Major, B. 109, Op. Posth.",https://open.spotify.com/track/0IeIIRG7nKNWUjsv6cjF2Y,Vitamin C,https://open.spotify.com/album/0ruVLRZy7KreVZyEKfFdXD,"Frédéric Chopin, James Rhodes","https://open.spotify.com/artist/7y97mc3bZRFXzT2szRM4L4, https://open.spotify.com/artist/5CDonRtIeV3ZYeE8nFjBUh",2023-04-05,83333,2022-04-19,Uplifting classical melodies to help you rise and shine.,Morning Classical
"Lilli Bulléro (Variations pour deux pianos sur un air anglais), Op.62",https://open.spotify.com/track/0WO8q4AZuEzErSF9ehJqWG,"Avec Esprit: Gouvy, Mélan-Guéroult, Saint-Saens, Ysaye",https://open.spotify.com/album/6zqdSi4fgfl5Y1IGJbFgsI,"Louis Théodore Gouvy, Tal & Groethuysen","https://open.spotify.com/artist/2aoB9gstGgiu0V4lL3S0c9, https://open.spotify.com/artist/3jcDwPU3uLhLAt5WZR1suZ",2023-04-05,648720,2022-04-19,Uplifting classical melodies to help you rise and shine.,Morning Classical
"Lyric Pieces, Book 5, Op. 54: Nocturne",https://open.spotify.com/track/2GJFu2G9fhaYFrOoX9bejs,Lullabies for Mila,https://open.spotify.com/album/7DfeNcn4aBR5eimaq9imOx,"Edvard Grieg, Alessio Bax","https://open.spotify.com/artist/5ihY290YPGc3aY2xTyx7Gy, https://open.spotify.com/artist/5XQSLo7FpTb3FJ69O7y2ur",2022-02-04,220773,2022-04-19,Uplifting classical melodies to help you rise and shine.,Morning Classical
Lágrima,https://open.spotify.com/track/1aMeBqrCnPf1CzRXlKyNFs,Romantic Guitar,https://open.spotify.com/album/0qPOwxdotqb7ODOOzhn5y3,"Francisco Tárrega, Julian Bream","https://open.spotify.com/artist/3cYz1jb3gzmFv2R0Dj3U2t, https://open.spotify.com/artist/6vjF8XdNoqVRj5G021FBM6",2022-02-04,123426,2022-04-19,Uplifting classical melodies to help you rise and shine.,Morning Classical
"Minuet in A major, D. 334",https://open.spotify.com/track/2FbUitqkfxFhI4An73HzZW,"Schubert: Piano Sonata D.959 & Minuets D. 334, D. 335, D. 600",https://open.spotify.com/album/11ihQmE1Jr4ehePrkwabZx,"Franz Schubert, Arcadi Volodos","https://open.spotify.com/artist/2p0UyoPfYfI76PCStuXfOP, https://open.spotify.com/artist/2DG9aIMzcln3w7SIVGGnmg",2022-02-04,193320,2022-04-19,Uplifting classical melodies to help you rise and shine.,Morning Classical
"Mozart: Clarinet Concerto in A Major, K. 622: II. Adagio",https://open.spotify.com/track/2fYOyayT80ysO3nxw9lKXn,Mozart: Clarinet Concerto/Debussy: Première Rhapsodie/Takemitsu: Fantasma/Cantos,https://open.spotify.com/album/6lu8QlTLnOsd199MZ7rHOy,"Wolfgang Amadeus Mozart, Sabine Meyer, Berliner Philharmoniker, Claudio Abbado","https://open.spotify.com/artist/4NJhFmfw43RLBLjQvxDuRS, https://open.spotify.com/artist/6kuAjH8jM4yaKQhZekTUgL, https://open.spotify.com/artist/6uRJnvQ3f8whVnmeoecv5Z, https://open.spotify.com/artist/6HclTVD03WSY6GUpN16BkP",2022-02-04,394560,2022-04-19,Uplifting classical melodies to help you rise and shine.,Morning Classical
"Mozart: Piano Sonata No. 12 in F Major, K. 332: II. Adagio",https://open.spotify.com/track/37xYs6sNliAOxdZonEnFVS,"Mozart: Complete Piano Sonatas - Piano Sonata No. 12 in F Major, K. 332: II. Adagio",https://open.spotify.com/album/4qzJ7IBY62YWcwJojnhlB7,"Wolfgang Amadeus Mozart, Elisabeth Leonskaja","https://open.spotify.com/artist/4NJhFmfw43RLBLjQvxDuRS, https://open.spotify.com/artist/3i67VvAwUlOKZa3fc75zs8",2022-02-04,291881,2022-04-19,Uplifting classical melodies to help you rise and shine.,Morning Classical
"Mozart: String Quintet No. 3 in C Major, K. 515: IV. Allegro",https://open.spotify.com/track/3O1IQIwr9vG6ZpqhMhntTE,Mozart: String Quintets K. 515 & 516,https://open.spotify.com/album/2Bw1ElP4NTVRByYTyDCOJj,"Wolfgang Amadeus Mozart, Quatuor Ébène, Antoine Tamestit","https://open.spotify.com/artist/4NJhFmfw43RLBLjQvxDuRS, https://open.spotify.com/artist/2fFxNneQmtCTdIwEpfXnqe, https://open.spotify.com/artist/31U8AuKww3USO1uWfUBnlr",2023-04-05,439877,2022-04-19,Uplifting classical melodies to help you rise and shine.,Morning Classical
